ID,id,article_title,article_language,journal_title,jounral_abbreviation,journal_issn,article_jvolumn,article_jissue,article_jcreated_at,article_pagination,author_list
436,49274.0,Randomized double-blind placebo-controlled trial of the 5-HT1A receptor antagonist AZD7371 tartrate monohydrate (robalzotan tartrate monohydrate) in patients with irritable bowel syndrome,eng,,,,103.0,0.0,1/8/01,2562-9 ST  - Randomized double-blind placebo-controlled trial of the 5-HT1A receptor antagonist AZD7371 tartrate monohydrate (robalzotan tartrate monohydrate) in patients with irritable bowel syndrome-,{J. NaesdalM. DanilewitzJ. AdlerD. G. DA  - Oct DO  - 10.1111/j.1572-0241.2008.02115.x DP  - NLM ET  - 2008/09/09 SilbergC. HwangD. A. Drossman}
437,687404.0,The impact of orthodontic treatment on the quality of life a systematic review.,eng,BMC Oral Health,BMC oral health,$1472-6831#,,3.530273809266456,,66,{Yi WangYu ZhouRongDang HuXiuYing WangGerald Volire}
438,858569.0,Phenotypic analysis of misato function reveals roles of noncentrosomal microtubules in Drosophila spindle formation,$English@@,JOURNAL OF CE#LL SCIE#NCE,J Cell Sci,,124.0,0.0,1/1%1/01,706-17,{M. GattiS. BonaccorsiV. Mottier-PavieF. VerniG. Cenci}
439,982590.0,,,Respirology,,,20.0,0.0,1/15/01,36,{I. YangJ. StonestreetP. CollinsP. Masel}
440,3276197.967294271,Effective combination chemotherapy with paclitaxel ??and cisplatin with or without human granulocyte colony-stimulating ??factor and/or erythropoietin in patients with advanced gastric cancer.,,BR. J. CANCER,,0007-0920,86.0,12.0,6/17/02,1858-63,{M RadererC GedlickaA LenauerD DepischW ScheithauerB SchneeweissW FiebigerF LangG V KornekB Sch_ll}
441,743989.0,A case of delirium triggered by sub-clinical seizures,,J. Am. Geriatr. Soc.,,14-Feb,63.0,0.0,,,{Ahmad A.S.}
442,71263.0,Intra-mandibular adenoid cystic carcinoma.,@@eng$,Revue de stomatologie de chirurgie maxillo-faciale et de chirurgie orale,Rev S@@tomatol Chir Maxillofac Chir Orale,2213-6541,115.0,7.419844482687906,1/14/04,100-4,{N Zwetyeng%aA Bouaichi#S Aimad-EddineB EllaX-A Mommers}
443,111970.0,Why is functional capacity decreased in hypertensive patients? From mechanisms to clinical studies.,eng,Journal of cardiovascular medicine (Hagerstown Md.),J Cardiovasc Med (Hagerstown),1558-2035,15.0,6.0,1/14/06,447-55,{Branislava IvanovicM??arijana Tadic}
444,941646.0,Personality profile and exercise?? dependence,,,,1592-1107,13.0,15.214678560922412,1/7/01,,{A. StumpoG. PalmieriM. F. PantusaM. MarascoV. Fuoco}
445,397190.0,,,Consumer Reports on Health,,1058-0#832,19.0,10.0,1/7/01,3-Mar,{NULL}
446,98562.0,Prevalence of Masked Hypertension in African Americans.,ENG,Journal of clinical hypertensio@@n (Greenwich Conn.),J Clin Hypertens (Greenwich),1751-7176,-1.0,-3.7867333602175135,,,{Frances WilliamsAlehegn GelayeSusan SteigerwaltYara DaloulHadeel AssadTimothy R LarsenBarryton WaanbahMichael Williams}
447,56014.0,Differences of inter-tract correlations between neonates and children around puberty: a study based on microstructural measurements with DTI.,eng,Frontiers in human neuroscience,Front Hum Neurosci,1662-5161,7.0,-1.0,1/13/01,721,{Gaolang GongHua ChengYong HeQi DongHao HuangVirendra Mishra}
448,911271.0,Electrocardiogram QRS detection using multiscale filtering based on mathematical morphology,En??gli??sh,Conference proceedings : ... Annual International Conference of the IEEE Engineering in Medicine and Biology Society. IEEE Engineering in Medicine and Biology Society. Conference,,1557-170X,,0.0,??@@1/7/01,3196$-31$99,{Department of Electrical F. ZhangElectrical Department ofNational Computer EngineeringSingapore Email elezf nus edu sg University of SingaporeSingapore National University of SingaporeF. ZhangEngineering ComputerAddress CorrespondenceY. LianAddresses Author}
449,565528.0,Barriers and facilitators to implementing electronic prescription: a systematic review of user groups' perceptions.,eng,Journal of the American Medical Informatics Association : JAMIA,J Am Med Inform Assoc,1527-974X,100.01170186305274,3.0,1/14/05,535-41,{Marie-Pierre GagnonClaude Sicotte_dith-Romy NsangouSonya GrenierJulie Payne-Gagnon$}
450,951143.0,Cystic fibrosis: cost of illness and considerations for the economic evaluation of potential therapies,eng,Pharmacoeconomics,,,21.0,79.91171228207016,1/3/01,1001-24,{T. WelteR. BusseN. JalilvandC. Krauth}
451,658707.0,Working memory short-term memory and reading disabilities: a selective meta-analysis of the literature.,eng,Journal of learning disabilities,J Learn Disabil,0022-2194,42.0,3.0,1/9/05,260-87,
452,,Hypothalamic obesity in children.,,Obesity reviews : an official journal of the International Association for the Study of Obesity,Obes Rev,1467-789X,55.21613225678532,9.0,1/12/09,,{A BereketZ HochbergY YavuzH L MullerR H LustigR WeissW KiessA P Goldstone}
453,891370.0,Health literacy diabetes self-care and glycemic control in adults with type 2 diabetes,eng,Diabetes technology & therapeutics,,1520-9156,12.0,11.0,1/10/01,913-9,{Chandra Y. and Bains Sujeev S. and Egede Leonard E. Osborn}
454,697286.0,Central corneal melting associated with reformulated generic diclofenac in a patient with inferior fornix foreshortening.,eng,Ophthalmology and eye diseases,Ophthalmol Eye Dis,117#9-$1721,3.0,0.0,1/11/01,@@2$1-24,
455,819701.0,Heart rate and blood pressure responses of left-handers and right-handers to autonomic stressors,??E#nglish,Indian Journal of Physiology and Pharmacology,,0019-5499,48.0,,1/4/01,31-40,{M.B. DikshitS. RajeD.S. JajuV.R. Purandare}
456,855099.0,,@@pol,Nowoczesne biomateria_y jako opatrunki hemostatyczne w chirurgii oszczedzajacej miazsz nerki--model zwierzecy. Doniesienie wstepne.,,0370-0747,37.0,2.0,1/7/01,May-51,{Przemys_aw P SzyberArtur PupkaPiotr SzyberJerzy Garcarek}
457,123492.0,Primary head and neck cancers in North -Western Nigeria,en%#g,,,,28.0,12.293249235088284,1/9/01,227-33,{P. H. JalloE. C. OtohA. MohammedS. O. AjikeN. W. JohnsonI. S. Danfillo}
458,226966.0,Vaginal incisional wound healing in a rabbit menopause model: a histologic analysis.,eng,International urogynecology journal,Int Urogynecol J,1433-3023,,12.0,1/12/12,1763-9,{Roger P GoldbergYoram AbramovBarbara GoldenPeter K SandMegan Sullivan}
459,850788.0,Acute and Persistent Postoperative Pain after Breast Surgery,,Pain Medicine,,,10.0,4.0,1/9/01,@@708-715%,
460,,The role of transforming growth factor-beta-mediated tumor-stroma interactions in prostate cancer progression: An integrative approach,,Cancer Research,,,69.0,,1/9/01,7111-7120,{G. E. AyalaA. R. A. AndersonD. BasantaR. B. LuknerO. E. FrancoS. W. HaywardD. E. CliffelD. W. Strand}
461,323305.0,Process of construction of an educational booklet for health promotion of pregnant women,,Revista latino-americana de enfermagem,Rev Lat Am Enfermagem,0104-%@@1169,20.0,1.0,1/12/01,101-108,{Luiza Akiko Komura HogaAna Luisa Zaniboni GomesLuciana Magnoni Reberte}
462,2049035.711214187,,eng,Thrombosis And Haemostasis,Thromb Haemost,0340-6245,110.0,26.57512860679678,1/1%3/11,1074-9,{D A LaneS ApostolakisG Y H LipH Buller}
463,743602.0,,eng,Public h??ealth nutrition,Public Health Nutr,1475-2727,17.0,12.0,1/14/12,Sep-92,{Makbule Gezmen-KaradagAnke OenemaSaskia J te VeldeHilal YildiranMai J M ChinapawJohannes BrugMine YildirimEda KoksalSaniye BiliciNilufer Acar-TekGamze AkbulutNevin SanlierMaartje M van StralenJudith S B de MeijAmika S Singh}
464,960371.0,,English,Cancer Treatment Reviews,,,30.0,1.0,1/4#/#01,19-35,{Hilary L. BekkerDavid J. DodwellRosalind F. Collins}
465,944668.0,Postamputation pain: epidemiolo%gy mec%hanisms and treatment,eng,J Pain Res,Journal of pain research,1178-7090,6.0,0.0,1/??13/??01,121-36,
466,4110298.2220650874,Bullous impetigo in children infected with methicillin-resistant Staphylococcus aureus alone or in combination with methicillin-susceptible S. aureus: analysis of genetic characteristics including assessment of exfoliative toxin gene carriage,eng,J Clin Microbiol,,0095-1137 (Print) 0095-1137,49.0,5.0,1/11/01,Apr-72,{T. YamamotoT. TakanoM. TakanoW. HiguchiY. NitaharaK. SaitoD. ShiK. Ozaki}
467,,Ebus-tbna yields multiple gene analyses and a panel of immunohistochemical stains on routinely prepared cell blocks in non-small cell lung cancer cases,English,Laboratory Investigation,,0023-$6837,,0.0,1/15/01,100A,{Z. MalekiO. Nikolskaia}
468,,The Social Workers Guide to Child and Adolescent Mental Health.,,Child & Family Social Work,,1356-7500,16.0,2.0,1/11/05,241-242,{Jo Finch}
469,2959498.123109247,Impact of endoscopic ultrasonography (EUS) on surgical decision-making in upper gastrointestinal tract cancer: An international multicenter study,,Surg. Endosc. Interv. Tech.,,-5514,70.95524144176328,3.0,,431-438,{Nielsen H.O.Edwin B.H_nerbein M.Hovendal C.Liedman B.Mortensen M.B.}
470,263027.0,Family care giving in the context of HIV/AIDS in Africa,,,,,21.0,3.357972810193746,1/13/01,13-21,{J. HuntR. A. Powell}
471,788168.0,Empowered diabetes management: life coaching and pharmacist counseling for employed adults with diabetes,,Health Educ Behav,Health education & behavior : the official publication of the Society for Public Health Education,1090-1981,40.0,5.0,1/13/01,58%1-9@@1,
472,700567.750270594,School neighborhood and family factors are associated with children's bullying involvement: a nationally representative longitudinal study.,eng,Journal of the American Academy of Child and Adolescent Psychiatry,J Am Acad Child Adolesc Psychiatry,1527-541$8,48.0,5.0,1/9/05,545-53,{Lucy BowesBarbara MaughanAvshalom CaspiLouise ArseneaultAlan TaylorTerrie E Moffitt}
473,498344.0,Infectious diseases. As Ebola wanes trials jockey for patients.,??eng,Science (??Ne$w York N.Y.),,,1736.2234435131477,6230.0,3/15/04,61.69717603366708,{Kai Kupfer??schmidt}
474,385772.0,DiGeorge Syndrome Presenting as Hypocalcaemia-Induced Seizures in Adulthood.,eng,Case Reports in Medicine,Case Rep.Med.,1687-9627,2013.0,-1.0,1/13/01,923129,{Alexander AttardJosephine PsailaAdrian ZammitDeborah Grech Marguerat}
475,3193696.6586481305,In vivo effects of different anesthetic agents on apoptosis.,eng,Korean Journal of Anesthesiology,Korean J.Anesth.,20$05-7563,63.0,1.0,1/12/07,18-24,
476,517503.0,,eng,Physics in medicine and biology,Phys Med Biol,1361-6560,55.0,12.0,6/21/10,,{Bin HeEric C Frey}
477,72325.0,Comparison between oral antibiotics and probiotics as bowel preparation for elective colon cancer surgery to prevent i@@nfection: prospective randomized trial.,eng,Su#rger$y,Surgery,,155.0,3.0,%1/14/03,4@@9@@3-503,{Yasuhiro KogaKazutake OkadaToru OzakiSotaro SadahiroAkira TanakaToshiyuki SuzukiHiroko Kamata}
478,516758.0,Comparison of 3D OS-EM and 4D MAP-RBI-EM reconstruction algorithms for cardiac motion abnormality classification using a motion observer.,ENG,IEEE transactions on nuclear science,IEEE Trans Nucl Sci,0018-9499,57.0,5.0,8/26/10,2571,{Taek-Soo LeeW Paul SegarsXin HeJing TangBenjamin M W Tsui}
479,85920.0,Adipocyte is a non-trivial dynamic partner of breast cancer cells.,eng,The International journal of developmenta#l biology,Int. J. Dev. Biol.,1696-3547,55.0,7.0,1/11/01,851-9,{Marie-Pierre ChenardNassim Dali-YoucefEmilie BuacheMari%e-Christine RioJinxiang$ Tan}
480,145874.0,HRQoL after coronary artery bypass grafting and percutaneous coronary intervention for stable angina.,eng,Scandinavian cardiovascular journal : SCJ,Scand. Cardiovasc. %J.,1651-2006,43.0,,1/9/04,Sep-94,{Michael LutherKari KorpilahtiMatti R TarkkaHeini HuhtalaJari LaurikkaJan-Ola WistbackaPertti Loponen}
481,888553.0,Weighting improves the information provided by joint counts on the severity of arthritis and its impact on patients' well-being in juvenile idiopathic arthritis,eng,Rheumatology (O#xford),Rheumatology (Oxford England),1462-0324,240.83345206505072,3.0,1/6/01,343-7,{A. RavelliS. Magni-ManzoniA. PistorioM. BandeiraA. MartiniE. SalaA. FalconeA. BuoncompagniN. RupertoA. Loy}
482,889580.0,Chronic pain-associated behaviors in the nursing home: resident versus caregiver perceptions,,Pain,Pain,0304??-3959,80.0,3.0,1/1/99,577-588,{F. KeefeB. PetersonD. Weiner}
483,732272.0,Analysis of responses of radiology personnel to a simulated mass casualty incident after the implementation of an automated alarm system in hospital emergency planning.,,Emergency Radiology,EMERG RADIOL,1070-3004,18.0,2.0,%1%/11/04,119-126 8p,{Linsenmaier UGeyer LLK_rner MMeisel CDWirth SReiser MF}
484,351877.0,Community nursing issues in Maori mental health.,,Australian & New Zealand Journal of Mental Health Nursing,,#1324-3780,5.0,2.0,6/1/96,54-62@@,{A StreetC@@ Walsh}
485,276000.0,Tobacco-related scenes in television dramas for young Japanese audiences,,Tob Control,,0964-4563,,3.0,1@@/1/99,1837.742214913955,{T. Sone}
486,2197563.3730909703,Alkaline phosphatase activity of duodenal enterocytes after neonatal administration of monosodium glutamate to rats.,%en$g,Physiological research / Academia Scientiarum Bohemoslovaca,Physiol Res,0862-8408,49.0,2.0,1/1/00,269-77,{L LenhardtS MozesA Martinkov}
487,684476.0,Pulmonary rehabilitation for chronic obstructive pulmonary disease: a pilot study evaluating a once-weekly versus twice-weekly supervised programme.,eng@@,Physiotherapy,Physiotherapy,1873-1465,96.0,3.5237322986493322,1/10/03,68-74,{Janet WebberFiona Liddell}
488,2198164.769519251,Primary Banded Roux-en-Y Gastric Bypass: a Systematic Review.,,,,,0.0,0.0,,,{NULL}
489,39687.0,Improving referrals to fracture clinic from the paediatric emergency department an intervention.,,,,,0.0,,,??-@@,{O. CallenderJ. CravenC. Martin}
490,3771128.675979982,Health literacy and child health promotion: Implications for research clinical care and public policy,,Pediatrics,,,124.0,,,S306-S314,
491,179093.0,Persistence of profenophos and quinolphos on cultivated cucumber and its removal,,,,,6.0,0.0,1/14/01,917-920,{B. VijayalakshmiD. Siva Rama PrasadD. RaveendranathK. Sri Rama MurthyA. Harinatha Reddy}
492,539034.0,Cognitive impairment and risk of cardiovascular events and mortality.,,,Eur. Hea%rt J.,1522-9645,33.0,14.0,1/@@??12/07,1777-86,{Salim YusufMartin O'DonnellCraig AndersonIrene MarzonaPeter SleightJeff ProbstfieldAntonio DansPeggy GaoJackie BoschKoon Teo}
493,208435.0,Comparison of tunnel positions in single-bundle anterior cruciate ligament reconstructions using computer navigation.,eng,Knee surgery sports traumatology arthroscopy : official journal of the ESSKA,Knee Surg Sports Traumatol Arthrosc,1433-7347,18.0,9.0,1/$10#/09,1282-9,{Travis G MaakThomas L WickiewiczVolker MusahlJames E VoosAndrew D Pearle}
494,,Fludarabine vs cladribine plus busulfan and low-dose TBI as reduced intensity conditioning for allogeneic hematopoietic stem cell transplantation: a prospective randomized trial,,,,,39.0,4.0,1/7/01,,{D. J. WeisdorfD. DouekY. TanL.?? J.@@ BurnsJ. S. MillerB. R. BlazarM. AroraT. DeForM. L. MacMillanM. MarkovaJ. E. WagnerJ. N. BarkerT. Repka}
495,36253.0,[Limited experience in adrenocortical function tests in infants].,,Horumon to rinsho. Clinical endocrinology,Horumon To Rinsho,0045-7167,16.0,4.0,4#/1/68,273-6,{Y HiroseS Ku%rataY?? Abe}
496,422857.0,Does this patient have obstructive sleep apnea?: The Rational Clinical Examination systematic review.,eng,JAMA,,,310.0,7.0,1/1#3/08,731-741,
497,720372.0,APPLICATION OF AGING MANAGEMENT STRATEGIES FOR REACTOR VESSEL INTERNALS AND CORE SUPPORT STRUCTURES,,Proceedings of the Asme Pressure Vessels and Piping Conference 2010 Vol 7,,978-0-7918-4926-2,0.0,0.0,,277-286,{H. Q. XuM. SnyderS. FyfitchA. ChetaG. Be$zdikianV. N. Sha#hT. R. LiszkaiH. CharkasN. GuptaY. ShojiC. S. BajwaC. MayM. SanwarwalaM. BrumovskyI. Ezekoye}
498,863342.0,Molecular detection of hepatitis B virus: Recent developments,,LaboratoriumsMedizin,,,29.0,1.0,1/5/01,33-43,{B. WeberA. Berger}
499,260745.0,Droperidol vs metoclopramide for prophylaxis of postoperative nausea and vomiting after breast cancer surgery,,,,,28.0,0.0,1/##11/01,560.222337490563,
500,941515.0,Is prolonged use of computer games a risk factor for deep venous thrombosis in children?,,Clinical medicine (London England),Clin Med,1473-4893,4.0,2.0,1/4/01,190-1,{Richard J. A. Murrin}%
501,641972.0,[Pelvic floor training for women with urinary incontinence].,dan,Forsinket implementering af internationale retningslinjer for computertomografi med iodholdigt kontraststof .,,16#03-6824,169.0,7.0,,593-5,{Sren BrostrmGunnar Lose}
502,699523.0,Regulating free speech,Engl#i$sh,,,,,2.0,1/1/91,289-318,{David Dyzenhaus}
503,,Older Women in the Homeless Shelter: Personal Perspectives and Practice Ideas,,Journal of Women & Aging,,0@@895-2841,23.0,4.0,1/11/01,36@@0-374,{Jennifer Davis-Berman}
504,,Ethically justified system-level decisions in health care: Toward a decision support workbook for healthcare leaders,,Dissertation Abstracts International: Section B: The Sciences and Engineering,,-94325,70.0,1.0,1/9/0??1,238,{Bashir Jiwani}
505,850418.0,Takayasu's arteritis with multiple intracranial aneurysms,,TAKAYASUSCHE ARTERIITIS MIT MULTIPLEN INTRAKRANIELLEN ANEURYSMEN,,0428-8246,,,,60-61,{Matsumoto K.Yamada F.Fukuda S.}
506,125302.0,Intravenous cyclophosphamide in patients with chronic systemic inflammatory diseases: morbidity and mortality.,e@@ng,Scandinavian journal of rheumatology,Scand$. J. Rheu$matol.,0300-9742,37.0,2.0,1/8/03,130-4,{E A M JanssenC BrodinP OgreidK KjellevoldL G GranssonL VattenP R RomundstadR OmdalK Wildhagen}
507,168889.0,Trends in domestic violence service and leadership: implications for an integrated shelter model,,Administration and policy in mental health,Adm Policy Ment Health,0894-587X,27.0,5.0,,339-52,{M. B. PhilipR. A. Hayward}
508,63977.0,[Clinical and histologic results of treatment of serous pulp inflammations with Ledermix].,,Czasopismo stomatologiczne,Czas Stomatol,Nov-53,20.0,11.0,1/1/%6%7,1145-53,{H Zakrzewska-Jastrzebska}
509,782211.0,Application of a model based on fuzzy logic for evaluating nursing diagnostic accuracy of students,English,International Journal of Medical Informatics,,,82.0,9.0,1/13/01,875-81,{R. JensenF. G. MatosA. da Cruz DdeP. S. SilveiraM. H. LopesN. R. Ortega}
510,473599.0,The effectiveness of N-acetylcysteine in preventing contrast-induced nephropathy in patients undergoing contrast-enhanced computed tomography: a meta-analysis of randomized controlled trials (Provisional abstract),,International Urology and Nephrology,,0301-1623,45.0,,1/13/01,1309-1318,
511,3081121.558799543,[Commentary on] Gait changes in children with cerebral palsy following a neuro-developmental treatment course. Adams M Chandler L Shuhmann K PEDIATRIC PHYSICAL THERAPY 2000;12:114-120,,Pediatric physical therapy,,,,1.0,,55-56 @@2@@p,
512,476199.0,Cognitive Outcome of Pediatric Moyamoya Disease.,eng,Journal of Korean Neurosurgical Society,J Korean Neurosurg Soc,2005-3711,57.0,28.52182344867397,1/15/06,440-4,{Ju-Seong KimDong-Seok KimEun-#Kyung ParkKyu-Won Shim}
513,405141.0,,eng,Bmj-British Medical Journal,,1756-1833,347.0,-1.0,1/13/01,$f$5001,{Rob M van DamFrank B HuIsao MurakiJoann E MansonFumiaki ImamuraQi SunWalter C Willett}
514,213794.0,A biomechanical study of replacement of the posterior cruciate ligament with a graft. Part II: Forces in the graft compared with forces in the intact ligament,,,,,79.0,3.0,1/1/97,381-386,{K.L. ArmstrongG.A.M. FinermanK.L. MarkolfM.S. ShapiroJ.R. Slauterbeck}
515,408902.0,The safety and immunogenicity of rotavirus vaccination in infants with intestinal failure,,J. Pediatric Infect. Dis. Soc.,,-14400,3.0,1.0,,57-65,{McNeal M.M.San??chez S.E.Jaco$b S.Javid P.J.Englund J.A.Horslen S.P.}
516,348281.73189235805,A growing lesion on @@the cheek.,eng,J%AMA otolaryngology-- head & neck% surgery,JAMA Otolaryngol Head Neck Surg,2168-619X,140.0,4.0,1/14/04,383-4,{Eric J LentschJordan Whitney RawlMichael J Caplan}
517,187552.0,Protective effect of ginsenoside Rb1 against myocardial ischemia/reperfusion injury in streptozotocin-induced diabetic rats,,Molecular Biology Reports,,0301-4851,38.0,29.309726486349142,1/1??1/0@@1,4327-4335,{Y. WuZ. Y. XiaH. M. LiuS. Q. LeiL. ZhangJ. J. XuB. ZhaoJ. Dou}
518,144339.0,Comparative in vitro performance of three small-volume valved holding chambers with beclomethasone/formoterol@@ pressurized metered dos@@e inhaler.,eng,,J Aerosol Med Pulm Drug Deliv,1941-2703,26.0,4.0,1%/13??/08,223-7,{Kamel AlhanoutJean-Christophe Du%busTalita Mota GoncalvesVeronique AndrieuAlain NicolayDavi Pereir$a de Santana}
519,656518.0,The effectiveness of anti-illicit-drug public-service announcements: a sys$tematic review and m$eta-analysis.,@@%eng,Journal of epidem%iology and community health.,,1470-2738,295.1776335147231,10.0,1/11#/10,834-40,{Julio S G MontanerKora DebeckEvan WoodThomas KerrEdward J MillsDan Werb}
520,925315.0,[Use of statins prior to or following invasive therapy for coronary artery disease].,??chi,CHUNG-HUA I HSUEH TSA CHIH [CHINESE MEDICAL JOURNAL],Chung Hua I Hsueh Tsa Chih,0@@376-2491,,40.0,,,{W$ei Gao}
521,130308.0,Malignant lymphomas of the oral region.,engfre,Canadian Forces Dental Services q#uarterly,Can Forces Dent Serv Q,0045-4850,18.0,1.0,1/1/77?#?,7-Jan,{J R TrottD J MorrowD W Buntine}
522,237077.0,Women's experiences%?? of acupuncture during labour,,British Journal of Midwifery,,0969-4900,,4.0,1/13/01,254-262,{Irena Anna FreiKath#arina FierzAngela PoatMartina Gisin}
523,600827.0,Nutritional supplementation for hip fracture aftercare in the elderly.,,Cochrane Database Syst. Rev.,,1469-493X,-1.0,22.271429121214023,1/1/00,CD001880,{A AvenellH H Handoll}
524,851773.0,Quality of life factors and survival after total or extended maxillectomy for sinonasal malignancies.,eng,Journal Of Oral And Maxillofacial Surgery: Official Journal Of The American Association Of Oral And Maxillofacial Surgeons,,1531-5053,73.0,4.0,1/15/0%4,,{James MurphyAmal IsaiahJoshua E LubekJeffrey S Wolf}
525,376582.70375062694,Epithelial Splicing Regulatory Proteins 1 (ESRP1) and 2 (ESRP2) Suppress Cancer Cell Motility via Different Mechanisms.,$eng,The Journal of biological chemistry,,1083-351X,1534.4826260454583,40.0,3/14/10,27386-99,{Mitsuyoshi MotizukiKeiji MiyazawaTetsuo KondoKeisuke MasuyamaMasao SaitohHiroki IshiiRyohei KatohKei SakamotoShota Tanaka}
526,425854.6110649453,,,Chinese medical journal,Chin. Med. J.,0366-6999,121.0,94.10990938655965,5/8/10,1945-52,{Zhi-yuan ZhangWei-liu QiuJia-wei Zheng}
527,254327.0,,eng,Oc??cupational M??edicine-Oxford,,0962-7480,58.0,2.0,1/8/03,Jul-83,{Jos H VerbeekRob KokJan L HovingFrederieke G SchaafsmaFrank J H van DijkPaul B A Smits}
528,556803.0,Neurocognitive assessment in 13 patients affected by muchopolysaccharidosis IVA (MPS IVA),,,,,37.0,,1/14/01,S136,{M. RigoldiS. GasperiniB. M. Del MenicoF. NichelliA. BonciminoM. CalabriaP. MeregalliR. Parini}
529,73792.0,Evaluation of the protective effect of Ilex paraguariensis and Camellia sinensis extracts on the prevention of oxidative damage caused by ultraviolet radiation.,,Environmental toxicology and pharmacology,Environ. Toxicol. Pharmacol.,1872-7077,37.0,1.0,1/14/01,195-201,{Marlon BargEmilio L StreckLara M GomesVanessa M AndradeDaniela D LeffaFelipe Dal-PizzolFabricia PetronilhoFrancieli VuoloMilena Carvalho-SilvaFernanda BalbinotGislaine T Rezin}
530,484593.0,New anticoagulants for atrial fibrillation.,eng,J. Cardiovasc. Med.,,1558-2027,10.0,6.0,1/9/06,446-53,{Raffaele De CaterinaGiulia RendaSteen Dalby Kristensen}
531,1496186.516680005,Our Health Counts -- Unmasking Health and S#ocial$ Disparities among Urban Aboriginal People in Ontario.,En#%glish,Dissertation Abstracts International A: The Humanities and Social Sciences,,,0.0,0.0,,,{Michelle Firestone}
532,105981.0,A common variant in the FTO gene is associated w@@ith body mas??s index and predisposes to childhood and adult obesity.,eng,Science (New York N.Y.),S??cie#nce,1095-9203,316.0,25830.9327806161,@@11/$7/05,,{George Davey SmithAmanda J BennettEleftheria ZegginiMarjo-Riitta JarvelinNicholas J WarehamLorna W HarriesColin N A PalmerShah EbrahimTimothy M FraylingSusan M RingBridget KnightSian EllardKatharine R OwenRachel M FreathyHana LangoDebbie A LawlorLon R CardonJohn R B PerryJeffrey C BarrettAndrew D MorrisGraham A HitmanKatherine S ElliottUlla SovioMark I McCarthyDavid MelzerAlex S F DoneyAndrew R NessYoav Ben-ShlomoAndrew T HattersleyAnn-Marie PatchNicholas J TimpsonNigel W RaynerMark WalkerMichael N WeedonRuth J F LoosFredrik KarpeIn_s BarrosoLuigi FerrucciChristopher J GrovesCecilia M LindgrenBeverley Shields}
533,,The parvalbumin-positive interneurons in the mouse dentate gyrus express GABAA receptor subunits 1 _2 and  along their extrasynaptic cell membrane.,en??#g,Neuroscience,,1873-7544,254.0,,12/19/13,80-96,{H H_gerW SieghartT KlausbergerI MilenkovicM VasiljevicD Maurer}
534,30272.0,,,Exp%erimental neurology,Exp. Neurol.,1090-2430,-1.0,,5/22/14,,
535,623367.0,Diagnosing acute cardiac ischemia in the emergency department: a systematic review of the accuracy and clinical effect of current technologies.,eng,Annals of Emergency Medicine American College of Emergency Physician's Research Forum,,01%96-06@@44,37.0,24.16518267661308,1/1/05,??45??3-60,
536,13408.0,Eczema - quiz.,eng,Paediatric$s &?? child health,,1918-1485,5.0,9.70519176907197,3/1/00,611.9734405572897,{NULL}
537,449003.0,Stroke i$n children with posterior fossa brain malformations hemangiomas arterial anomalies coarctation of the aorta and cardiac defects and eye abnormalities (PHACE) syndrome: A systematic review of the literature.,,,,,0.0,0.0,,,{NULL}
538,299297.0,,,Family & Community Health,,0160-6379,34.0,4.0,1/11/10@@,319-330,{Terry-Lynn??e M$arkoTyler Watt}
539,302268.0,Review of Handbook for Working with Children and Youth: Pathways to Resilience across Cultures and Contexts,English,,,,47.0,3.0,,230-232,
540,592663.0,Helicobacter pylori antibiotic resistance patterns and genotypes in adult dyspeptic patients from a regional population in North Wales,eng,,,,54.0,2.0,1/4/01,,{A. M. WalkerJ. XerryK. DaviesN. C. ElvissR. J. Owen}
