ID,id,article_title,article_language,journal_title,jounral_abbreviation,journal_issn,article_jvolumn,article_jissue,article_jcreated_at,article_pagination,author_list
216,2108429.6812970447,Isolates and antibiotic resistance of culture-proven endophthalmitis cases presented to a referral center in Tehran,eng,,,,19.0,,1/12/01,361-3,{M. M. ParvareshM. HashemiR. SoodiS. NekoozadehS. A. AlemzadehK. G. FalavarjaniM. Modarres}
217,,,,Public health reports (Washington D.C. : 1974),Public Health Rep,0033-3549,108.0,3.0,,,{NULL}
218,288711.0,Laparoscopic reversal of Hartmann's rectosigmoidectomy,,Colorectal disease : the official journal of the Association of Coloproctology of Great Britain and Ireland,Colorectal Dis,1462-8910,10.0,1.0,1/8/01,,{S. SlawikA. R. Dixon}
219,184949.0,The situation of Romanian HIV-positive adolescents: Results from the first national representative survey,,,,,22.0,0.0,1/10/01,562-569,{D. BuzduceaBuzducea Cohen Johnson Lazar Lazar Lejars Lyon Marin McDowell Mardarescu O'Leary Paxton Wood BergerF. LazarE. I. Mardare}
220,833251.0,Life stress and the long-term treatment course of recurrent depression: III. Nonsevere life events predict recurrence for medicated patients over 3 years,,Journal of Consulting and Clinical Psychology,,,,1.0,1/6/01,1%12-120@@,{E. FrankL.D. TorresD. KupferK.L. HarknessJ. GuillaumotJ.E. RobertsS.M. Monroe}
221,470174.0,Value of spiral CT in hemodynamically stable patient#s following blunt chest trauma.,eng,Computerized Medical Imaging and Graphics: The Official Jo@@urnal of the Computerized Medical@@ Imaging Society,,0895-6111,22.0,6.0,11/1/98,447-%52,%{R TelloK KandarpaR F MundenS HootonR Pugatch}
222,315926.0,Preventing injuries through interventions fo@@r problem drinking: a systematic review of randomized controll@@ed trials,,,,,,15.723740927825265,,609-21,
223,901385.0,Nutrition and obstructed labor,,American Journal of Clinical Nutrition,,,72.0,1.0,,291S-297S,{O. A. LadipoJ. C. Konje}
224,787529.0,Rationale design and methods of the HEALTHY study nutrition intervention component,eng,Int$ J Obes (??Lond),International journal of obesity (2005),0307-0565,,0.0,1/9/01,S29-36,{S. McCormickB. GillisA. VirusM. A. StatenC. MobleyS. L. VolpeJ. BridgmanL. El ghormliD. D. StadlerJ. Hartstein}
225,431348.0,Atomoxetine treatment of children and adolescents with ADHD: Clinical questions and answers. (German),,,,,0.0,0.0,,,{NULL}
226,,,,,,,0.0,0.0,,,{NULL}
227,481882.0,Inhibition of cisplatin-induced lipid catabolism and weight loss by ghrelin in male mice.,en@@%g,Endocrinolog%y,Endocrinology,1945-7170,154.0,35.288236162939256,1/1@@3/#09,3118-29,{Thomas SchererJose M GarciaVictor PapushaJi-an ChenMark AsnicarJoanna SmiechowskaBobby GuilloryChristoph BuettnerRoy G SmithAnriada Nassif}
228,572425.0,Primary cutaneous large B-cell lymphoma of the legs: a distinct clinical pathologic entity treated with CD20 monoclonal antibody (rituximab).,eng,American Journal of Clinical Oncology-Cancer Clinical Trials,,0277-3732,24.0,15.622469621224322,,237-40,{D M Aboulafia}
229,,,,International Journal of% Behavioral Consultation and Therapy,,1555-7855,2.0,3.0,1/6/01,432-438,{Marcie W. HandlerJames K. LuiselliJennifer A. Mautone}
230,455406.0,Green tea in dermatology. [Review],,,,,0.0,,,,{NULL}
231,696362.0,Teaching Calculus and Other Challenging Courses to Nontraditional and At-Risk Students at a Research University.,,McNeill Mathematics Program,College Teaching,87567555,,4.0,1/6/01,291-297,{C. G. Mendez}
232,2310506.4719325094,Tropical infection after a case of total hip arthroplasty.,%en$g,The Journal of hospital infection,J. Hosp. Infect.,1532-2939,87.0,3.0,1/14/07,179-81,
233,800900.0,Chronic pelvic pain.,eng,,Best Pract Res Clin Gastroenterol,1532-1916,23.0,4.0,1/9/01,593-610,{Andrew Paul Baranowski}
234,235689.0,Obstetrical anal sphincter laceration and anal incontinence 5-10 years after childbirth,eng,Am J Obstet Gynecol,American journal of obstetrics and gynecology,0002-9378 (Print) 0002-9378,207.0,27.469132139498072,1/12/01,42@@5.e1-6,{K. C. McDermottJ. L. BlomquistV. L. HandaE. C. Evers}
235,659896.0,Comparative effectiveness of instructional design features in simulation-based education: systematic review and meta-analysis.,en$g??,Medical teacher,Med Teach,1466-187X,,1.0,1/13/01,e867-98,{Benjamin ZendejasStanley J HamstraRose HatalaDavid A CookAmy T WangJason H SzostekPatricia J ErwinRyan Brydges}
236,84944.0,Body mass index and outcome @@of ASC-H-interpreted cervical smears in @@postmenopausal women.,e%ng,Acta cytol??ogica,Acta% Cytol.,Jan-47,56.0,,1/12/01,259-@@65,{Jae Jun LeeSang Yong SongSoomin AhnYoung Lyun OhJi-Youn SungChang Ohk SungYoo-Young Lee}
237,326944.0,,eng,Atherosclerosis. Supplements,Atheroscl%er Supp??l,1567-5688,4.0,4.0,1/3/12,29-32,
238,922795.0,,ger,Schlafst_rungen bei kritisch kranken patienten,,17-Mar,45.0,-1.0,2/1/96,S10-3,{R M $JonesP Conzen}
239,768486.0,Functionality and feedback: a protocol for a realist synthesis of the collation interpretation and utilisation of PROMs data to improve patient care,eng,BMJ Open,,2044-6055,17.451566646208274,7.0,1/14/01,e005601,{C. MillsS. DalkinJ. GreenhalghC. WoodL. WoodJ. WrightE. GibbonsN. BlackJ. M. ValderasR. PawsonD. Meads}
240,428363.0,Case report. Cutaneous cryptococcosis in a patient with systemic erythematous lupus.,eng,Mycoses,Mycoses,0933$-7407,,50.89145629456761,1/1/11,419-21,{L RamosS Mathur_nA MateoC L_pezC G_mez}
241,519287.0,A method for determining skeletal lengths from DXA images.,,BMC Musculoskelet Disord,BMC musculoskeletal disorders,1471-??247??4,8.0,,1/7/01,113,{Glen M BlakeTim D SpectorIgnac FogelmanUsha Chinappen-Horsley}
242,638918.0,Imaging for target volume delineation in rectal cancer radiotherapy--a systemati%c review.,,Clinical Oncology (Royal College of Radiologists),,1433-2981,94.51973937899362,1.0,1/12/02,52-63,{R WebsterE SpeziS MukherjeeR AdamsS GwynneJ StaffurthB Coles}
243,111336.0,The influence of smoking and impaired glucose homoeostasis on the outcome in patients presenting with an acute coronary syndrome: a cross-sectional study.,e#ng@@,BMJ Open,,2044-6055,4.0,7.0,1/14/01,e005077%#,{Anders HallingHkan OdebergHenrik ForssellJacob OdebergMarie-Louise PerssonLennart RstamIvar VaaraUlf LindbladMichael Freitag}
244,747279.0,Systematic review exploring the effect of exercise in pulmonary rehabilitation on depression levels in patients with chronic obstructive pulmonary disease,,Physiotherapy,Physiotherapy,,377.6513530951511,0.0,,eS502-eS503,{Patil S.Horobin H.}
245,674696.0,Environmental and genomic factors as well as interventions influencing smoking cessation: a systematic review of reviews and a proposed working model.,eng,Public health genomics,Public Health Genomics,1662-8063,16.0,4.0,1/13/01,1%59-73,{A BrandJ Van der HeydenS de VironH Van OyenN Malats}
246,258108.0,Impact of seasonality on recruitment retention adherence and outcomes in a web-based smoking cessation intervention: randomized controlled trial,,,,,15.0,0.0,1/13/01,e249-,{Mushro ANiaura R SGraham A LCobb N KFang YCha S}
247,59308.0,White matter diffusivity predicts memory in patients with subjective and mild cognitive impairment and normal CSF total tau levels.,,Journal of the International Neuropsychological Society : JINS,J Int Neuropsychol Soc,1469-7661,16.0,1.0,1/10/01,58-69,{Ramune GrambaiteAnders M FjellTormod FladbyKristine B WalhovdVidar StensetIvar Reinvang}
248,610641.0,Comparison between open and closed suction systems: a systematic review.,ENGPOR,Revista Brasileira de terapia intensiva,Rev Bras Te??r In#tensiva,1982-4335,20.0,4.0,1/8/12,331-338,${Luiz Rogrio de Carvalho OliveiraNilza Aparecida Almeida de CarvalhoFlvio C L Cavalcanti Ara_joIzabela Menezes PagottoPaulo Chiavone}
249,631704.0,Association between interleukin-10 promoter polymorphisms and endometriosis: a meta-analysis.,eng,Gene,Gene,1879-0038,515.0,1.0,2/15/13,49-55,{Qiong ChenWei FanQianhong MaZhongying HuangZhun XiaoShangwei Li}
250,846537.0,Overactive bladder: Optimizing quality of care,,$Am. J. Managed Care,,1088-0224,7.0,10.842396423517103,,S46-S61,%{Le#mack G.E.}
251,,Thyroid-related autoantibodies and celiac disease: a role for a gluten-free diet?,,Journal of Clinical Gastroenterology,,,185.5206378542823,16.909332181428887,1/2/09,245-8,{E. MainardiG. MoscatoA. MontanelliM. DottiR. Nano}
252,931402.0,Providing access to specialty care for severely disabled institutional residents: an academic health center telemedicine model,,,,1049-2089,20.0,6.014167809849293,1/9#/01,415-422 8p,{A. K. MarceeS. P. RoatenJ. B. MorrowK. J. KowalskeL. E. SnellL. L. Goetz}
253,908690.0,A robust method for diagnosis of morphological arrhythmias based on Hermitian model of higher-order statistics,English,Biomedical engineering online,,1475-9@@25X%,10.0,0.0,1/11/01,22,{Address CorrespondenceS. KarimifardAddresses Authorahmadian@sina.tums.ac.ir Tehran Medical PhysicsTehran Medical PhysicsDepartment of Biomedical Systems S. KarimifardTums Tehran Iran Email University of Medical SciencesA. AhmadianTums Tehran Iran University of Medical SciencesSystems Department of Biomedical}
254,,Shared decision making and the future of managed care,,Disease Management and Clinical Outcomes,,1088-3371,1.0,1.0,1/1/97,,{J. E. Wennberg}
255,759329.0,Specific plasma factors blocking human maternal cell-mediated immune reaction to placental antigens.,eng,Nature: New biology,Nature Ne$w Biol.,0090-0028,242.0,,3/28/73,110-1,{V YoutananukornP Mantangkasombut}
256,,MicroRNAs: a new piece in the paediatric cardiovascular disease puzzle.,eng,Cardiology in the young,Cardiol Young,1467-1107,23.0,5.0,1/13/10,642-55,{Dalia ElimamKeith A WebsterAhmed OmranFei YinLina A Shehadeh}
257,695010.0,Association of Ureaplasma urealyticum colonization with development of bronchopulmonary dysplasia: a systemic review and meta-analysis.,eng,Journal of Huazhong University of Science and Technology. Medical Sciences,J Huazhong Univ Sci Techn$olog Med Sci,1672-0733,34.0,10.03329259707768,1/14/04,265-9,{Jia-rui PuDan LiDe-hua YangLi-duan ZhengXiao-dan ZhengHong MeiXuan XiangQiang-song Tong}
258,1079564.5254003406,,,Journal of Epidemiology and Community Health,,0143-005X,68.0,6.0,1/14/01,524-529,{J. FalkinghamM. EvandrouA. VlachantoniJ. Robards}
259,384767.0,A multinational study of thromboprophylaxis practice in critically ill child$r$en.,eng,Critical care medicine,Crit. Care Med.,1530-0293,42.0,5.0,1/14/05,1232-40,{Sarah H O'BrienMarisa TucciAntonio Rodriguez NunezPhilip C SpinellaLi QinEdward Vincent S FaustinoAdrienne G RandolphEdward TruemperSimon LiKimberly MarohnSheila HansonMichael Yung[Collective Name] PROphylaxis against ThRombosis prACTice (PROTRACT) Study Investigators of the PALISI BloodNet}
260,855912.0,Asymmetric inheritance of $m%itochondrial content in aging budding yeast cells,English,Molecular Biology of the Cell. Conference: Annual Meeting of the Am@@erican Society for Cell Biology ASCB,,,23.0,,1/12/0@@1,,{E. A. MartinL. F. CostaH. LiY. ZhangM. P. VianaS. M. RafelskiW. F. Marshall}
261,710727.0,Physical activity moderates time-of-day differences in older adults' working memory performance.,,Experimental Aging Research,,0361-073X     1096-4657,32.0,4.0,1/6/10,431-446 16p,{DeLosh ELBugg JMClegg BA}
262,816996.0,Uses of the electrical skin resistance method in the study of patients with neck and upper extremity pain,Eng@@lish,Johns Hopkins Medical Journal,JOHNS HOPKINS MED. J.,,137.0,2.0,1#/1/75,69-74,{C.P. RichterL.H. Riley Jr.}
263,625016.0,[Ne@@w aspects in hernia surgery].,ger,Ur??ologe A,,0340-2592,44.0,7.0,1/5/07,774-9,{P E GoretzkiB J LammersT Otto}
264,275675.0,An explor#ation of self-reported negative affect by adolescents as a reason for smoking: implications for tobacco @@prevention and intervention programs,,Prev Med,Preventive medicine,0091-7435,41.0,2.0,1/5/01,589-96,{J. RobinsonD. W. SmithB. ColwellS. L. StevensC. McMillan}
265,,Diagnosis of peripheral lung cancer with three echoic features via endobronchial ultrasound,English,Chest,,,132.0,3.0,1$/7/01@@,92$2-9%,{H. C. ChenS. M. LinC. L. ChouC. T. YuH. P. KuoC. H. Kuo}
266,640230.0,A meta-analysis of labor supply effects of interventions for major depressive disorder.,eng,Psychiatric Services.,,,57.0,2.0,1/6/02,212-8,{Justin W TimbieMarcela Horvitz-LennonSharon-Lise T NormandRichard G Frank}
267,625663.0,Combined pharmacotherapy and psychological treatment for depression: a systematic review.,eng,Archives of General Psychiatry,Arch.Gen.Psychiatry,0003-990X,61.0,7.0,1/4/07,714-9,{Paola BolliniGiuseppe TibaldiBruce KupelnickCarmine MunizzaSandro Pampallona}
268,,,,Journal of Sexual Medicine,,,,0.0,1/15/01,,
269,2826873.6738619744,eComment. EuroSCORE II - corrected in-hospital mortality rate in a modern cohort of patients undergoing cardiac surgery,Engl%i@@sh,In??t%eractive Cardiovascular & Thoracic Surgery,Interact Cardiovasc Thorac Surg,,64.9614610925764,28.007703379337336,1/14/01,733,{D. G. Nezic}
270,2541813.06380273,The effect of a cervical lateral glide on the upper limb neurodynamic test: a blinded placebo-controlled investigation,,The Chartered Society of Physiotherapy Annual Congress and Exhibition: Defining Practice Friday October 17 to Sunday October 19 2003 International Convention Centre Birmingham.,,,0.0,,%1/3/01,1%0-Oct,
271,836847.0,Thoracic Aortic Aneurysm: Reading the Enemy's Playbook,,,,-10475,33.0,5.0,,203-277,${$Elefteriades J.A.}
272,867207.0,Early predicting of blood component quality by Statistical Process Control,,Vox Sanguinis,,0042-9007,99.0,0.0,,227,{H. JungkW. MadlaV. SchottstedtT. Alt}
273,253149.0,,,The British Journal of Psychiatry,,0007-1250 1472-1465,173.0,0.0,1/#1/#98,185-185,{A. S. LeeS. DaviesP. C. Naik}
274,929971.0,A geographic analysis of chronically homeless adults before and after enrollment in a multi-site supported housing initiative: community characteristics and migration,,American Journal of Community Psychology,,0091-0562,48.0,3.0,1/11/01,341-51,{R. A. RosenheckJ. TsaiA. S. Mares}
275,2226754.5044634286,Fetal cleft lip and palate detection by three-dimensional ultrasonography,,Ultrasound Obstet. Gynecol.,,-8906,16.0,4.0,,314-320,
276,731703.0,Substance Abuse and Trauma in Incarcerated Women,,,,,0.0,0.0,1/??11/0#1,,{NCT0#1413984 }
277,113399.0,Use of Job Design to Reduce Mechanical Stress on the Back,,,,,0.0,0.0,1/1/89,323-326,{D. W. Badger}
278,3078395.6184731484,,eng,Annual Abstract Supplement,,0016-5085,425.38983667163893,5.0,1/2/05,1314-21,{Mark KernKaren DikemanBarbara GrandeMarta KazandjianTerilynn NitschkeStephanie DanielsBenson MasseyReza ShakerCaryn Easterling}
279,653325.0,A meta-analysis of two genome-wide association studies identifies 3 new loci for alcohol dependence.,eng,Journal# of psychia@@tric research,J Psychiatr Res,1879-1379,45.0,11.0,,1#419-25,{Min ZengYue PanQunyuan ZhangKe-Sheng WangNagesh AragamXuefeng Liu}
280,893573.0,Crowdsourced Multimedia Enhanced Spatio-temporal Constraint Based on-Demand Social Network for Group Mobility,,??Proceedings of the 23rd AC#M international conference on Multimedia,,978-1-4503-3459-4,0.0,0.0,,761-762,{Ahmad QamarMuhammad ShahidMd. Abdur RahmanAhmed LbathAkhlaq AhmadFaizan Ur RehmanAbdullah MuradBilal Sadiq}
281,56272.0,Impaired default network functional connectivity in autosomal dominant Alzheimer disease.,,Neurol#ogy,Neurology,,81.0,8.0,8/20/13,736-44,{Virginia D BucklesAndrew J SaykinEric McDadeStephen P SallowayAaron P SchultzPeter R SchofieldRandall BatemanAdam M BrickmanNick C FoxJohn C MorrisJohn M RingmanChristopher C RowePaul ThompsonClifford JackBeau M AncesAllison M GoateRobert A KoeppeStephen CorreiaJasmeer P ChhatwalCaroline A SullivanAnne M FaganRichard MayeuxDaniel S MarcusTammie L S BenzingerKeith JohnsonReisa A SperlingChengjie Xiong}
282,4074883.8793480988,Cranial reconstruction of major traumatic defects in children with osteoinductive and resorbable materials,,International Journal of Oral and Maxillofacial Surgery,,0901-5027,40.0,0.0,,1024-1025,{R. R. M. BosE. W. HovingM. Wagemakers}
283,680306.0,Meta-analysis of the effects of sometribove zinc suspension on the production and health of lactating dairy cows.,eng,Journal of the American Veterinary Medical Association,J. Am. Vet. Med. Assoc.,1943-569X,,5.0,1/14/09,550-64,
284,53877.0,Journal of Health Communication : International Perspectives The Effect of an Internet-Based  Stage- Matched Message Intervention on Young Taiwanese Women ' s Physical Activity,,,,,0.0,0.0,1/14/01,37-41 DO  - 10.1080/10810730902805788,{Sheu-jen HuangMaiga ChangWen-chi HungJanie Cha$ng}
285,504928.0,Azathioprine for multiple sclero@@sis,,,,,0.0,4.0,1/7/01,,{Ilaria CasettaGerardo IulianoGraziella Filippini}
286,198650.0,,,,,,7.0,0.0,1@@/1/92,27-32 ST  - Wound care-,{NULL}
287,4015251.4408538262,Comparison between incidental malignant and benign breast lesions detected by computed tomography: a systematic review.,eng,Journal of medical imaging a@@nd radiation oncology,J Med Imaging Radiat Oncol,1754-9485,57.0,5.0,,52%9-33,{Jasmin AbbasCholpan JasaabuuAndreas Gunter BachAlexey SurovDominik SchrammAndreas Wienke}
288,981412.0,,,European Respiratory Journal,,,44.0,0.0,1/14/01,,{N. M. PinheiroR. Almeida-ReisL. OlivaM. A. MartinsM. L. V. OlivaO. A. Theodoro-JuniorE. A. LeickI. F. L. C. TibrioC. M. PradoR. F. RighettiB. T. M. Oliveira}
289,785472.0,Streptococcus pneumoniae carriage in the Gaza strip,eng,PLoS One,PloS one,1932-6203,,4.0,1/12/01,e35061,{G. RahavG. Regev-YochayI. AbullaishA. ElhamdanyR. MalleyM. RazA. GoralY. RoytmanB. ShainbergM. VaronA. Ziv}
290,734077.0,Direct healthcare costs and cost-effectiveness of acute coronary syndrome secondary prevention with ticagrelor compared to clopidogrel: Economic evaluation from the public payer's perspective in Poland based on the PLATO trial results,English,Kardiologia Polska,,0022-9032,72.0,9.0,1/14/01,823-830,{M. NiewadaJ. PaweskaA. BudajT. MaciochP. Perkowski}
291,46028.0,Changes in renal blood flow measured by radionuclide angiography following exhausting exercise in humans.,eng,European journal of applied physiology and occupational physiology,Eur J Appl Physiol Occup Physiol,0301-5548,399.72209321152746,1.0,1@@/1/??96,7-Jan,{S IkawaM SudohM SuzukiS MatsubaraM ShiotaK Kawakami}
292,743129.0,Hormonal and dietary characteristics in obese human subjects with and without food addiction.,eng,Nutrients,N??utri#ents,2072-6643,7.0,1.0,1/15/01,223-38,{Pardis PedramGuang Sun}
293,1822384.6322557135,Importance of membrane materials for blood purification devices in critical care.,eng,Transfusion and apheresis science : official journal of the World Apheresis Association : official journal of the European Society for Haemapheresis,,,40.0,1.0,1/9/02,23-31,{Narumi TomisawaAkihiro C Yamashita}
294,904889.0,Myofascial trigger points: Spontaneous electrical activity and its consequences for pain induction and propagation,,Chin. Med,,$17#49-8546,6.0,0.0,,,{Ge H.-Y.Fernndez-de-las-Peas @@C.Yue S.-W.}%
295,360147.0,Treatment of large ve$ssel vasculitis,,,,1573-3955%     1875-631X,34.131992402317536,4.0,1$/11%/01,435-442,{M. A. AlbaS. Prieto-GonzalezA. Garcia-MartinezM. C. CidM. ButjosaG. Espigol-FrigoleJ. Hernandez-Rodriguez}
296,670289.0,,eng,Tumour biology : the journal of the International Society for Oncodevelopmental Biology and Medicine,Tumour Biol.%,1??423??-0380,35.0,3.0,1/14/03,2777-85,{Bin HuHong-ju MaoJing ZhaoYing HuangRong-huan YuChao Guan}
297,821702.0,Cognitive deficits and psychosis in Parkinson's disease: A review of pathophysiology a@@nd t%herapeutic options,English,CNS Drugs,,,20.0,6.0,,477-505,{T. FoltynieR.A. BarkerS.J.G. LewisC.H. Williams-Gray}
298,188890.0,,eng,Scandinavian journal of infectious diseases. Supplementum,Scand J Infect Dis Suppl,0300-8878,78.0,-1.0,@@1/1??/91,22-34,{R AsangerP M Sha@@hF M Kahan}
299,321660.0,,,,,,189.0,4.0,1/#$14/01,390-3,
300,427455.0,Cultural humility: essential foundation for clinical researchers.,,Applied nursing research : ANR,Appl$ Nurs Res,??1532-8201,97.60536659387952,12.61309739851864,1/13/11,251%@@-6,{Katherine A YeagerSusan Bauer-Wu}
301,246204.0,,,Aktuelle Traumatologie,,,34.0,2.0,1/4/01,,{J. OskamJ. H. HegemanJ. $PalenH. J. DuisP. A. M. Vierh??out}
302,857402.0,High resolution EPR spectroscopy of C(60)F and C(70)F in solid argon: reassignment of C(70)F regioisomers,English,,J Chem Phys,1089-7690,127.0,8.0,1/7/01,84301,{D. A. TyurinV. A. BelovD. N. LaikovA. V. AkimovE. Y. Misochko}
303,704357.0,Clinical and radiological results of calcium phosphate cement-assisted balloon osteoplasty for Colles' fractures in osteoporotic senile female patients,eng,,#Journal of orthopaedic science : official journal of the Japanese Orthopaedic Association,,15.0,2.0,1/10/01,,
304,716785.0,Explosive power and asymmetry in leg muscle function in frequent fallers and non-fallers aged over 65,,,,,31.0,2.0,1/2/01,119-125 7p,{Rutherford OMKennedy JSkelton DA}
305,746065.0,Anxiety and depression in patients with chronic obstructive pulmonary disease: an open agenda for research.,,Rev Med Chir Soc Med Nat Iasi,Revista medico-chirurgicala a Societatii ??de Medici si Naturalisti din I%asi,0048-7848 (Print) 0048-7848,118.0,1.0,,39-44,{Costin M.Dumbrav__ E.L.Postolache P.Cojocaru D.C.}
306,738322.0,,eng,J O%kla State% Med Assoc,,0030-1876 (Print) 0030-1876,86.0,24.61166423417034,1/1/93,,{S. PelofskyP. D. Hunter}
307,934177.0,An Assessment of Voluntary Adolescent Mental Health Screening and Referral in a Children's Hospital Emergency Department,,,,,0.0,0.0,,,{NCT00750412 }
308,351534.0,Implementing participatory intervention and research in communities: lessons from the Kahnawake Schools Diabetes Prevention Project in Canada,English,Social Science and Medicine,,,56.0,20.500195356930554,1/3/01,1295-1305,{T DelormierA C MacaulayM CargoA M McComberL Potvin}
309,872389.0,Bile acid metabolism by fresh human colonic contents: a comparison of caecal versus faecal samples.,eng,Gut,Gut,0017-5749,49.0,6.0,1/1/12,835-42,{R H DowlingG M MurphyP B HylemonG FrenchM J VeyseyL A Thomas}
310,499983.0,The role of viral infection in pulmonary exacerbations of     bronchiectasis in adults: a prospective study,English,Chest,,,147.0,6.0,1/15/01,1635-1643,{Gao YHLin ZYZhang GJZhong NSChen RCGao YTang YLin ZMXu $GLi HMGuan@@ WJ}
311,452432.0,Feverfew (Tanacetum parthenium L.): A systemati@@c review.,,,,,0.0,0.0,,,{NULL}
312,320139.0,Impact of second-line drug resistance on tuberculosis treatment outcomes in the United States: MDR-TB is bad enough,English,,,,,10.0,1/12/01,1331-4,{J. P. CegielskiS. P. Althomsons}
313,3837612.414865815,Muscle variables of importance for physiological performance in competitive football.,ENG,Europ#ean journal of applied ph@@ysiology,Eur. J. Appl. Physiol.,,-1.0,-1.0,8/15/10,,{Sebastien RacinaisOlivier GirardLars NyboMagni MohrMartin Thomassen}
314,978471.0,,,,,,0.0,0.0,1/3/01,,{Gary P. WormserAlvin E. Friedman-KienMiguel Sanchez}
315,652212.522644661,Recurrent distal 16q duplication and terminal 22q deletion: prenatal diagnosis and genetic counseling,,,,,49.0,0.0,1/10/01,544-7 ST  - Recurrent distal 16q duplication and terminal 22q deletion: prenatal diagnosis and genetic counseling-,{D. D. TownC. P. ChenY. N. SuW. CN  - PubMed DA  - Dec DO  - 10.1016/s1028-4559(10)60117-9 DP  - NLM ET  - 2011/01/05 WangC. W. PanC. C. LeeF. J. TsaiP. C. WuM. C. Huang}
316,90272.0,Role of core-needle biopsy in thyroid nodules with initially nondiagnostic cytologic results.,eng,Radiology,,,270.0,2.0,1/14/02,629-30,{Qiao-Hong HuZhi-Liang HuangXiao-Ming FanShuang-Xi ChenXiang-Yang SongXiao-Ying Qiu}
317,776651.0,The endoplasmic reticulum-associated VP7 of rotavirus is targeted to axons and dendrites in polarized neurons,English,Journal of Neurocytology,,,126.65325986911104,8.0,1/1/93,616-626,{K. Kris@@tenssonL. SvenssonH. B. GreenbergK. Weclewicz}
318,,Telemedicine in the management of chronic pain: a cost analysis study,,Canadian Journal of Anaesthesia,,,56.0,8.0,1/9/01,590-6,{R. KernA. PronovostP. Peng}
319,623358.0,Moderation of cognition-intention and cognition-behaviour relations: a meta-analysis of properties of variables from the theory of planned behaviour.,eng,,Br J Soc Psychol,0144-6665,43.0,0.0,,159-86,
320,385940.0,Normalisation of left ventricular systolic function after change from VVI pacing to biventricular pacing in a child with congenital complete atrioventricular block long-QT syndrome and congenital muscular dystrophy: a 10-year follow-up.,eng,Cardiology in the young,,1467-1107,72.93508031584622,3.0,1/14/06,520-3,{Jesper I ReimersSabrina G ElleseHenrik  Andersen}
321,4457411.393846336,Estimating the Effect of Land Leases on Prices of Inner-city Apartment Buildings,,Urban Studies (Routledge),,420980,40.0,10.0,1#/3/01,2049,{Christian T. L. Janssen}
322,515254.0,Radiographic detection of artificially created horizontal root fracture using different cone beam CT units with small fields of view.,eng,Dento maxillo facial radiology,Dentomaxillofac Radiol,0250-832X,42.0,4.0,1/13/01,20120261,{S MuratH AvseverS Y_kselC S PaksoyB OnderK Kamburoglu}
323,,Pharmacological treatments for obsessive-compulsive disorder in chi#ldren and adolesc$ents: a qualitative review.,eng,Actas espaolas de psiquiatr_a,Actas$ Es??p Psiquiatr,1578-2735,41.0,3.0,1/13/05,,{Angel Rosa-AlczarAna I Rosa-AlczarMarina Iniesta-Sep_lveda}
324,1164437.1082658316,Anterior approach unilateral right sacrospinous fixation for recurrent pelvic organ prolapse following multiple colorectal surgeries.,ENG,International journal of colorectal disease,Int J Colorectal Dis,,-1.0,-1.0,7/15/01,,
325,178078.0,A community-based trachoma survey: Prevalence and risk factors in the Tigray region of northern Ethiopia,,,,,13.0,0.0,1/6/01,173-181,{J. De La CameraM. M. MesfinA. M. KedirG. AmanualT. ArayaI. G. Tareke}
326,453637.0,Corneal collagen cross-linking for$ nonectatic disorders: A sy#stematic review.,,,,,0.0,0.0,,,{NULL?$?}
