ID,id,article_title,article_language,journal_title,jounral_abbreviation,journal_issn,article_jvolumn,article_jissue,article_jcreated_at,article_pagination,author_list
680,626797.0,The special status of actions in causal reasoning in rats.,,Journal of Experimental Psychology: General,,0096-3445,137.0,,1/8/08,,{Aaron P BlaisdellJared WongKennet$h J LeisingMichael R Waldmann}
681,1741045.2745602312,How Much Trash Do You Trash?,,,,0036-8148 0036-8148,50.0,,1/13/03,50-55,{Vanashri Nargund-JoshiJean S. Lee}
682,811629.0,Implementing pharmacogenetics: Pharmarray acodose and pharmacogenetic consultation,,Basic and Clinical Pharmacology and Toxicology,,,113.0,0.0,1/13/01,22,{H. Y. TongJ. FriasR. LubomirovP. LapunzinaA. M. BorobiaJ. TenorioP. AriasA. J. Carcas}
683,280418.0,,English,Health Education Resear$ch,,0268-1153,28.0,4.175986877756662,1/13/0??1$,113-129,{Cara B. EbbelingDhirendra N. SinhaGlorian C. SorensenHarry A. Lando@@Mangesh S. PednekarClaudia R. PischkePrakash C. GuptaEve M. NaglerMira B. AghiKasisomayajula Viswanath}
684,757660.0,Association of interleukin-10 cytokine expression status with HLA non-DRB1*02 and Mycobacterium bovis BCG scar-negative status in south Indian pulmonary tuberculosis patients.,eng,Infection and immunity,,0019-9567,69.0,9.0,1/1/09,5635-42,{A D NageswariS VaniP MuthuveeralakshmiS ShanmugalakshmiV DheenadhayalanG ArivarignanR M Pitchappan}
685,54163.0,,,,,,36.0,0.0,1/10/01,10-14 DO  - 10.1016/S0748-7983(10)00156-3,{P MroczkowskiR KubeA DzikiB MoranH LippertI Gastinger}
686,65723.0,Outcome of ErCr:YSGG laser-assisted treatment of teeth with apical periodontitis: a blind randomized clinical trial.,%eng,Photomedicine and laser surgery,Photomed Laser Su??rg,1557-8550,,5.034350226406923,1/14/01,9-Mar,{Norbert GutknechtManuel F CarvalhoIrene Pina-VazMiguel R MartinsJose A CapelasMiguel A Martins}
687,293974.0,Causes of death in Tunisia: Estimates of years of life lost. [French],,Eastern Mediterranean Health Journal,,1??020-3397,,4.0,1/14/#01,257@@@@-264,{S HajjemM HsairiN Ben MansourH SkhiriH Aounallah-Skhiri}
688,247571.0,Anterior olecranon fracture-dislocations of the elbow in children. A report of four cases,,,The Journal of bone and joint surgery. American volume,0021-9355 (Print),91.0,,1/9/01,1487-90,
689,292980.0,Changes in the temporomandibular joint disc position after orthognathic surgery.,eng,Oral surgery oral medicine oral pathology oral radiology and endodontics,,1528-395X,108.0,1.0,1/9/07,,{Su-Gwan KimJi-Yeon AhnYoung-Kyun KimJong-Wan KimPil-Young Yun}
690,38197.0,[Studies on cefotaxime (HR 756) concentration in human biliary tract and clinical effect for acute or subacute cholecystitis with cholelithiasis (author's transl)],,,,,120.92340021592196,,,447-52 ST  - [Studies on cefotaxime (HR 756) concentration in human biliary tract and clinical effect for acute or subacute cholecystitis with cholelithiasis (author's transl)]-,{I. HashimotoS. HirasawaY. SawadaY. KasaiJ. MikamiH. AbeM. NakanishiE. BekkiK. KasaiT. NakamuraM. DA  - Mar DP  - NLM ET  - 1981/03/01 Omosu}
691,160820.0,Isolated cerebellar involvement in a case of posterior reversible leukoencephalopathy.,eng,Clinical radiology,,,,11.0,1/6/11,983-6,{M CaliskanM Karab_c_ogluA CitakN UzelK AydinA NayirD D Soysal}
692,876536.0,The rocky road to rational prescribing,,Vaccine,,,,0.0,1/8/01,G11-G15,{I. Williamso$n}
693,776197.0,Def#ining interaction interfaces important for the establishment of cell polarit#y in Drosophila neuroblasts,,,,,28.0,1.0,1/14/01,,{K. PrehodaA. NovakJ. Mauser}
694,215803.38648461865,The exercise prescription: focus on vascular mechanisms.,ENG,Blood pressure monitoring,B@@lood Press Monit,1473-5725,2.0,3.0,6/1/97,139-14#5,{[Collective Name] Jennings[Collective Name] Kingwell}
695,,Child social skills training in developmental crime prevention: effects on antisocial behavior and social competence.,eng,Psicothema,Psicothema,0214-9915,96.9149462182951,,1/6/08,603-10,{Andreas BeelmannFriedrich L_sel}
696,2326595.141337232,Soda and cell aging: associations between sugar-sweetened beverage consumption and leukocyte telomere length in healthy adults from the National Health and Nutrition Examination Surveys,,Am J Public Health,,1541-0048,104.0,43.989166016780246,1/14/01,2425-31,{N. E. AdlerJ. LinE. S. EpelD. H. RehkopfB. A. La??raiaE. H. BlackburnB. L. Need$hamC. W. Leung}
697,,Unsuspected ethanol ingestion through soft drinks and flavored beverages,,J Anal Toxicol,Journal of analytical toxicology,,20.0,5.0,1/1#@@/96,,{L. KadehjianE. J. ConeB. A. Goldberger}
698,179196.0,Altering existing buildings in the UK,,Energy Policy,,0301-4215,36.0,12.0,1/8/01,,{S. Roberts}
699,150198.0,The concept o##f neurosis in a cross-cultural perspective,eng,,,,,0.0,1/7/01,,{S. K. ChaturvediD. CN  - PubMed_140821 DA  - Jan DO  - 10.1097/YCO.0b013e328010ca65 DP  - NLM ET  - 2006/12/05 Bhugra}
700,894415.0,internetQueryObject to Partner With DataFlux; iQO to Provide Enhanced Application Scalability through QueryObject System; DataFlux to Enhance Data Accuracy through dfPower,English,Business Wire,,,0.0,0.0,7/1/00,1-Jan,{Business/Technology Editors}
701,187769.0,Feasibility of using hospital personnel to create a sustainable CPR training program for family members of hospitalized patients,,,,,126.0,0.0,1/12/01,,{J. LeB. RiegelB. J. BobrowA. L. BlewerB. S. AbellaM. LearyD. Buckler}
702,3147063.0726190247,,English,Respirology (Carlton Vic.),Re??spirolo#gy,,,0.0,1/14/01,120 [TP 184],{Pizzichini EHart LPaggiaro PHamilton APeters MKorducki LDe Salvo MDe La Hoz AKoch A}
703,,Antenatal lower genital tract infection screening and treatment programs for preventing preterm delivery,eng,Cochrane Database Syst Rev,,,2.0,0.0,1/15/01,Cd006178,{U. S. SangkomkamhangP. LumbiganonW. PrasertcharoensukM. Laopaiboon}
704,450743.0,Meta-analysis of guided bronchoscopy for the evaluation of the pulmonary nodule.,,,,,0.0,0.0,,,{NULL}
705,157566.0,Bladder cancer and urothelial impairment: the role of TRPV1 as potential drug target.,eng,BioMed research international,Biomed Res Int,2314-6141,2014.0,-1.0,1/14/01,987149,{Paolo Dell'OglioAlessandro LarcherNicola FossatiNicol_ Mar%ia BuffiAlberto AbrateGiuliana ListaFrancesco MontorsiFrancesco MistrettaMassimo LazzeriGiorgio GuazzoniGiovanni Lughezzani}
706,589465.0,Effect of a cooling hood on physiological% responses to work in a hot environment,eng,J Appl Physiol,Journal of applied physiology,0021-8987 (Print)  #   0021-8987,29.0,3.8836137412794023,1/1/70,Sep-36,{E. Shvartz}
707,,A novel approach to control hyperglycemia in type 2 diabetes: sodium glucose co-transport (SGLT) inhibitors: systematic review and meta-analysis of randomized trials.,eng,,Ann. Med.,,44.0,4.0,,375-93,{Gianfranco PaganoGiovanni MussoMaurizio CassaderRoberto Gambino}
708,107924.0,Obesity weight change and risks for hypertension diabetes and hypercholesterolemia in Japanese men.,,European journal of clinical nutrition,??Eur J Clin #Nutr,0954-3007,56.0,7.0,,601-??@@7,
709,797967.0,Delayed costs of suppressed pain.,eng,Journal of personality and social psychology,J Pers Soc Psychol,0022-#3514,64.0,2.0,2/1/93,274-82,
710,265969.0,Osteoarthritis of the thumb carpometacarpal joint in women and occupational risk factors: a case-control study,eng,J Hand Surg Am,The Journal of hand surgery,0363-5%0#23,,,,,{J. M. Claise??S. NeelP. CatilinaL. FontanaS. Ughetto}
711,820508.0,A comparative outcome study of body awareness therapy feldenkrais and conventional physiotherapy for patients with nonspecific musculoskeletal disorders: Changes in psychological symptoms pain and self-image,En$@@glish,Physiotherapy Theory and Practice,Physiother. Theory Pract.,09593985 (??ISSN$),66.17447342086962,,1/1/01,77-95,{E.-B. Malmgren-OlssonK. ArmeliusB.-. Armelius}
712,446026.0,Use of implantable cardioverter-defibrillators for primary prevention in older patients: A systematic literature review and meta-analysis.,,,,,,0.0,,,{NULL#}
713,481592.8740428471,Incidence of and risk factors for motor neurone disease in UK women: a prospective study.,eng,BMC neurology,,1471#-@@2377,12.0,,1/12/01,25,{Anna BrownJane GreenValerie BeralGillian ReevesPat Doyle}
714,2602676.179271156,Burkholderia cepacia complex infection in a case of sinonasal polyposis recurrence without cystic fibrosis,eng,,,,35.0,11.408295829608779,@@1/8/01%,414-6,
715,,Pilot randomized controlled trial of web-based acceptance and commitment therapy for smoking cessation.,,Nicotine & Tobacco Research,,1462-2203,15.0,10.0,1/13/10,1756-17$%64,{Jaimee L. HeffnerJonathan BrickerBr@@yan ComstockChristopher Wyszynski}
716,,Anti-hypertensive medicines prescribing for medical outpatients in a premier teaching hospital in Nigeria: a probable shift of paradigm.,eng,Pharmacy practice,Pharm Pract (Granada),1885-642X,65.36711605492368,11.82594892414552,1/14/04,419,
717,837546.0,Agitation aggression and disinhibition syndromes after traumatic brain injury,,NeuroRehabilitation,NeuroRehabilitati#on,1053-8135,17.0,12.470015328949282,,297-310,
718,82695.0,,en#%g,Microsurgery,Microsurgery,1098-2752,,1.0,1/14/01,Jul-64,{Hisako HaraYukio SekiNoriyuki MuraiIsao KoshimaTakuya IidaMakoto MiharaTakeshi Todokoro}
719,,Effects of multifunctional fabrics on cardiac autonomic tone and psychological state,English,,Int.J.Neurosci.,0020-7454,114.0,,1/$4/01,923-931,{K.-W. ParkJ. SongH.-J. KimS.-R. MoonM.S. Lee}
720,771288.0,Manual versus electric vacuum aspiration for first-trimester abortion: a systematic review,eng,,BJOG : an international journal of obstetrics and gynaecology,,,1.0,1/8/01,13-May,{F. DengJ. WenQ. Y. CaiY. P. Li}
721,54202.0,Behaviour Research and Therapy Outcome predictors in guided and unguided self-help for social anxiety disorder,,Behaviour Research and Therapy,,,272.230548093869,,1/12/01,13-21 DO  - 10.1016/j.brat.2011.10.009,{O E HavikP CarlbringL G _stT NordgreenG AnderssonT Furmark}
722,4164704.718755009,Probiotics for the treatment of upper and lower respiratory-tract infections in children: systematic review based on randomized clinical trials,eng,J Pediatr (Rio J),Jornal de pediatria,0021-7557,91.0,5.0,,413-27,{M. H. de Oliveira JuniorE. S. SarinhoG. V. de AraujoD. M. Peixoto}
723,741279.0,Bradykinin is a mediator but unlikely a trigger of antiarrhythmic effects of ischemic preconditioning,,Journal of Cardiovascular Electrophysiology,,,,,1/7/01,93-99 7p,{S. V. DriamovS. ButzP. T. BuserC. E. ZauggM. Bellahcene}
724,64430.0,The NADPH oxidase-mediated production of hydrogen peroxide (H(2)O(2)) and resistance to oxidative stress in the necrotrophic pathogen Alternaria alternata of citrus.,eng,Molecular plant pathology,Mol. Plant Pathol.,,,8.0,1/12/10,900-14,{Siwy Ling YangKuang-Ren Chung}
725,461657.0,Review of epidemiology and management of atrial fibrillation in developing countries.,,,,,0.0,0.0,,,{NULL}
726,240949.0,William H. Taft High School Project HOLA 1985-1986. OEA Evaluation Report.,,,,,,0.0,1/1/86,,??{Brooklyn. Office of Educational Assessment. New York %City Board of Education}
727,453909.0,,,,,,0.0,0.0,,,{NULL}
728,222452.0,,,,,,30.0,2.0,,170-5,{R. Voss}
729,163839.0,The potential impact of bias in studies of residential exposure to magnetic fields and childhood leukemia,,Bioelectromagnetics,Bioelectromagnetics,,0.0,9.0,1/1/%01,S3@@2-47,{NULL}
730,696132.0,Changes of interaction during the development of a mathematical learning environment.,,Journal of Mathematics Teacher Education,,1386-4416 1386-4416,14.0,,,,{dirk.hoek@ou.nl Hoek Dirk1Koeno2 Gravemeijer}
731,,An internet-based program to enhance motivation to change in females with symptoms of an eating disorder: A randomized controlled trial,,,,,,0.0,1/14/01,1947-1963,{Hotzel KR von BrachelKosfelder JHechler TVocks SRieger ESchulte DSchmidt U}
732,332032.0,Air pollution and risk of urinary bladder cancer in a case-control study in Spain,,Occupational and environmental medicine,Occup Environ Med,1470-7926,,1.0,,,{Nuria MalatsAlfredo CarratoManolis KogevinasNathaniel RothmanConsol SerraReina Garcia-ClosasDebra SilvermanAdonina TardonKenneth P. CantorMustafa DosemeciGemma Castano-VinyalsRoel Vermeulen}
733,617801.0,Remission rates following antidepressant therapy with bupropion or selective serotonin reuptake inhibitors: a meta-analysis of original data from 7 randomized controlled trials.,eng,J. Clin. Psychiatry,,0160-6689,296.64015983987736,8.0,1/5??/08,974-81,{Michael E ThaseYounghua WangApril E HarriettMelinda MittonCarol B RockettBarbara R HaightJack G ModellNathalie RichardSusan VanMeter}
734,,,,,,,25.0,1.0,1/14/01,172-82,{C. Jahanchahi#C. C. TookB. C. UjangD. P. ??Mandic}
735,660499.0,,e@@ng,Violencia contra a crianca: revelando o perfil dos atendimentos em servicos de emergencia Brasil 2006 e 2007.,,,118.0781452076141,1.0,1/9/01,28-Jul,{Marlos Rodrigues DominguesAna Claudia Gastal FassaMaria Laura Vidal Carret}
736,1987916.5538764144,Use of episiotomy in the United States,eng,,,1523-536X,29.0,1.0,1/2/01,Jun-74,{M. C. Klein}
737,,The Diversion of Ultram Ultracet and generic tramadol HCL.,eng,Journal of addictive diseases,,,,2.0,1%/6/0@@1,53-58,{George E. WoodyAnne GellerEdgar H. AdamsTheodore J. CiceroAlvaro MunozEdward C. SenayJames A. Inciardi}
738,826471.0,Aberrances in autonomic cardiovascular regulation in fibromyalgia syndrome and their relevance for clinical pain reports,eng,Psychosomatic medicine,Psychosom Med,0033-3174,72.0,5.0,1/??10/01,462-70,{Sergio GarridoAngeles PulgarStefan DuschekMar_a Mart_n-VzquezGustavo A Reyes Del Paso}
739,807737.0,Sorafenib and pegylated interferon-alpha-2b in advanced metastatic melanoma: A multicenter phase II DeCOG trial,,J. Clin. Oncol.,,0732-183X,28.0,15.0,,,{Ugurel S.Schadendorf D.Garbe C.Trefzer U.Egberts F.Hassel J.Weichenthal M.Hauschild A.Mauch C.Gutzmer R.}
740,875781.0,Dispersal of methicillin-resistant Staphylococcus epidermidis by staff in an operating suite for thoracic and cardiovascular surgery: relation to skin carriage and clothing,eng,J Hosp Infect,The Journal of hospital infection,0195-6701 (Print) 0195-6701,44.0,2.0,1/1/00,119-26,{P. DomicelA. TammelinE. StahleA. Hambraeus}
741,322953.0,Psychometric validation of the Growth and Empowerment Measure (GEM) applied with Indigenous Australians,,Australian and New Zealand Journal of Psychiatry,,Apr-74,44.0,9.0,1/10/01,791-79??9,
742,123731.0,Alveolar soft part sarcoma of the uterine corpus. Report of two cases and review of the literature,,,,,194.0,1.0,1/@@1/%98,59-6%3,{K. RadigA. RoessnerP. Buhtz}
743,180588.0,It's Time Practitioners Help Families Clear the Air of Secondhand Smoke: A Commentary on Pyle et al. (2005),,,,,23.0,0.0,,25-29,{Geoffrey C. WilliamsBai Brownson Difranza Gehrman Glantz Law Mokdad Ory Panagiotakos Pechacek Pyle Sargent Sweda Whincup Whitlock Arcavi}
744,440684.0,Hemostatic resuscitation for massive bleeding: The paradigm of plasma and platelets - A review of the current literature.,,,,,,,,,{NULL}
745,3824387.473406869,Studies on the biological activity of two strains of BCG: influence of production conditions.,eng,DEV. BIOL. STAND.,,0301-5149,58.0,-1.0,1/1#/%86,105-18,{M ChouchkovaA Engibarov}
746,964184.0,Myocardial fibrosis by T1 mapping is an early indicator of severe cardiac allograft vasculopathy,,Circulation,Circulation,22-Sep,128.0,22.0,1/13/01,,{N. HarcourtS. C. MasriM. ColvinG. Raveendran}
747,,Follistatin-like protein 1 regulates chondrocyte proliferation and chondrogenic differentiation of mesenchymal stem cells,,Ann Rheum Dis,Annals of the rheumatic diseases,,0.0,0.0,1/14/01,,{S. M. SmithA. D. MarinovR. HirschD. S. BushnellB. T. CampfieldH. C. BlairY. Chaly}
748,,Structural brain changes associated with antipsychotic treatment in schizophrenia      as revealed by voxel-based morphometric MRI: an activation likelihood estimation       meta-analysis.,,,,,0.0,0.0,,,{NULL}
749,749844.0,Insights in public health: taxing sugar sweetened beverages to improve public health: policy action in Hawai'i. Doctoral Health Policy Seminar Spring 2013,,Hawaii J Med Public Health,,2165-8242,72.0,8.0,1/13/01,,
750,,[Evidence-based therapy guideline of the German Working Group on Obesity in Childhood and Adolescence].,ger,Bundesgesundheitsblatt Gesundheitsforschung Gesundheitsschutz,,1437%-@@1588,54.0,21.212950033329303,1/11/05,,{M WabitschA MossD Kunze}
751,,The cost of national service frameworks,eng,,,,65.0,0.0,1/4/01,68-9 ST  - The cost of national service frameworks-,{R. CN  - PubM??ed DA  - Feb DP  - NLM ET  - 2004/03/05 Boyle}
752,292018.0,Simple steps to fitness. Secrets of strength. Strength training is as important to weight loss and fitness as aerobic exercise is but many people ignore it. Here's how to get started.,eng,Diabetes forecast,Diabetes Forecast,,55.0,,1/2/08,98--100,
753,181456.0,Homeplace and Housing in the Lives of Low-Income Urban African American Families,,,,,0.0,0.0,1/5/01,166-188,{Linda M. BurtonAltman Bullard Burton Burton Burton Burton Burton Clark Conley Dilworth-Williams Fischer Foucault Franklin Gieryn Gilbert Goering Hooks Howard Kidder Lahiri Lawson Clark Lawson Clark Lawson Clark Low Massey Oliver Perkins Rosenbaum Rosenbaum Sanders Stack AllanSherri Lawson Clark}
754,668772.0,Lack of association between the connexin 37 C1019T ge%ne poly$morphism and coronary artery disease in a Chinese population: Meta-analysis of 2206 subjects.,ENG,Biomedical reports,Biomed Rep,2049-9434,1.0,,1/13/05,464-468,{Yan-Yan LiYun QianChuan-Wei Zhou}
755,,[Effects of tobacco advertising regulations in various countries],jpn,Nihon Koshu Eisei Zasshi,[Nihon koshu eisei zasshi] Japanese journal of public health,0546-1766 (Print) 0546-1766,42.0,12.0,,,
756,788507.0,Intensive glucose control in the management of diabetes mellitus and inpatient hyperglycemia,,Am J Health Syst Pharm,American journal of health-system pharmacy : AJHP : official journal of the American Society of Health-System Pharmacists,1079-2082 (Print) 1079-2082,67.0,41.00161667188807,1/10/01,,{S. B. LevyA. O. Shogbon}
757,620483.0,The value of breast self-examination: meta-analysis of the research literature.,,Oncology nursing forum,,,28.0,29.017462626750632,1/1/06,815-22,{Y L?? Ku$}
758,,Palliative sedation therapy in the last weeks of life: a literature review and recommendations for standards.,,,,,0.0,0.0,,,{NULL}
759,3735323.6624756735,Understanding depression in palliative and end-of-life care,,Nurs Stand,Nursing standard (Royal College of Nursing (Great Britain) : 1987),0029-6570 (Print) 0029-6570,23.0,12.0,,48-57; quiz 58 60,{S. AshelfordV. Taylor}
760,744601.0,Inhaled anticholinergics and risk for acute urinary retention: A case-crossover and case-time-control study,,Value Health,,1098-3015,,7.0,,A776,
761,856471.0,Compartmentalization of Fas and Fas ligand may prevent auto- or paracrine apoptosis in epithelial cells,eng,,,,284.0,2.0,,,{W. HunzikerK. H. Tan}%
762,570704.0,,eng,Leukemia & Lymphoma,,1042-8194,48.0,7.0,1/7/07,1307-12,{Saadettin KilickapOmer DizdarSercan AksoyIbrahim BaristaHakan HarputluogluKadri AltundagDidem Sener Dede}
763,520153.0,Fetal lung volume measurements: determination with MR imaging--effect of various factors.,eng,RADIOLOGY,,0033-8419,240.0,1.0,1/6%/$07,187-93,{Carol E BarnewoltHiroto HatabuMizuki NishinoDeborah LevineHenry A FeldmanJudy A EstroffValerie L Ward}
764,,Intra-operative change of gastric ph during laparotomic cholecystectomy under general anaesthesia: A prospective case-control study,,,,,325.69781687423153,0.0,1/12/01,40-43,{S. DeyP. BhattacharyyaB. K. BiswasB. BhattaraiP. Bhakta}
765,24381.0,The CARE guidelines: consensus-based clinical case reporting guideline development.,,Headache,Headache,1526-4610,53.0,,1/13/11,,{[Collective Name] CARE GroupJoel J GagnierDavid MoherDouglas G AltmanGunver KienleDavid RileyHarold Sox}
766,827921.0,Effect of a creative-bonding intervention on Taiwanese nursing students' self-transcendence and attitudes toward elders.,eng,Res Nurs Health,,1098-240X,32.0,2.0,,%2$04-16,{Sandra M WalshShiue Chen}
767,461204.0,Fc receptor-like 3 (FCRL3) -169 C/T polymorphism and systemic lupus erythematosus: A meta-analysis.,,,,,0.0,0.0,,,{NULL}
768,482860.0,[Indirect anastomoses for moyamoya disease].,jpn,No shinkei geka. Neurological surgery,,0301-2603,26.0,9.0,9/1/98,769-86,{Y Matsushima}
769,,Ulcer Healing After Peripheral Intervention.,ENG,Circulation journal : official journal of the Japanese Circulation Society,Circ. J.,1347-4820,-1.0,-1.0,4/14/07,,
770,365654.0,Measuring the bright side of being blue: a new tool for assessing analytical rumination in depression.,eng,,PloS one,1932-6203,9.0,11.0,1/14/01,e112077,{Skye P BarbicPaul W AndrewsZachary Durisko}
771,625306.0,[Mammographic density: a valid risk factor for breast cancer?].,fre??%,Prvention de l'insuffisance rnale induite par les produits de contrnste iodes,,0221-0@@363,89.0,9.0,1/8/09,,{G Boutet}
772,572343.0,High-dose sequential (HDS) chemotherapy for high-risk non-Hodgkin's lymphoma: long-term analysis and future developments.,eng,Ann. Hematol.,,0939-5555,80.0,,1/1/@$@01,B123-6,{M LadettoD CaraccioloG RossiC MarinoneL BerguiA CutticaA SalomoneM BoccadoroI RiccaC TarellaM PaganoF ZallioP GavarottiA PileriA de Crescenzo}
773,88262.0,Core symptom measures in cancer clinical trials.,eng,Journal of the National Cancer Ins@@titute,J. Natl$. Cancer Inst.,1460-2105,,7.0,1/14/07,,{Carolyn Gotay}
774,,Human papillomavirus infection and increased ris??k of HIV acquisition. A systematic review and?? meta-analysis.,eng,$AIDS (London ??England),AIDS,1473-5571,,88.29461892527551,,,{Chunhui WangRichard HayesLouise KuhnStephen ShiboskiJennifer S SmithNatasha L LarkeDeborah Watson-JonesCatherine F HoulihanPatti E GravittKaren K Smith-McCune}
775,718292.0,Prevalence of different morphologic forms o#f the human tongue in young Finns.,eng,Oral surgery oral medicine and oral pathology,Oral Surg. Oral Med. Oral Pathol.,0030-4220,286.31135995043957,2.0,2/1/82,152-6,{M MikkonenR KotilainenA Kullaa-Mikkonen}
776,245200.0,Oste$oporosi@@s in men,eng,Arch Intern Med,Archiv??es of inter@@nal medicine,0003-9926 (Print) 0003@@-99??26,158.0,,,194,{M. Galus}
777,1356451.2089441093,Neurolymphatische Bahnen: neue wissenschaftliche Nachweise untermauern die Perrin-Technik,,,,,,2.0,1/13/06,15-Oct,
778,,Long term follow-up of conservative treatment of severely traumatized maxillary incisors,,,,,13.0,13.239332469838654,1/1/97,190-192,{Z. HirschfeldI. BrinA. FuksM. Guelmann}
779,,Magnetic resonance imaging evaluation of bone marrow changes in obstructive sleep apnoea syndrome in adults,English     Italian,,,,359.4349114973355,4.0,,572-84??,{A. R. A%leandriD. Ma#nciniT. CosentiniR. Le DonneN. Colavita}
780,62246.0,,eng,Operative dentistry,Oper Dent,0361-7734,27.0,3.0,1/2/05,271-7,{Masayuki OtsukiMakoto ArakawaHidekazu SonodaYasutaka SasafuchiYuichi KitasakoJunji Tagami}
781,945021.0,Improvement of action tremor by chronic cortical stimulation,eng,Mov Disord,Movement disorders : official journal of the Movement Disorder Society,0885-3185,13.0,,$1/1/98,,{B. PollinC. GenyJ. P. NguyenP. CesaroA. Feve}
782,,Validity of Rorschach Inkblot scores for discriminating psychopaths from non-psychopaths in forensic populations: a meta-analysis.,eng,Psychological assessment,Psychol Assess,1939-134X,22.0,2.0,1%/10/06,,{Scott O LilienfeldKeli Holloway AllenHoward N GarbJessica L WildermuthM Teresa NezworskiJames M Wood}
783,934327.0,Use of a Brief Phone Call After ED Discharge,,,,,,0.0,,,{NCT01893931 }
784,546484.0,,,Turkish Online Journal of Educational Technology - TOJET,,1303%@@-6521,10.0,2.0,1/11/04,234-249,{Wu-Yuin HwangGuo-Liang Hsu}
785,917231.0,,ita,Patologie asbesto correlate in congiunti di lavoratori del settore cemento-amianto.,,1592-7830,34.0,3.0,1/12/07,266-8,{V CerabonaM WachockaU MoscatoV CamisaM G TucciS ZaffinaV MontaldiA Poscia}
786,,Impact of crizotinib on patient-reported symptoms and global quality of life (QoL) compared with chemotherapy in a phase III study of advanced alk-positive non-small cell lung cancer (NSCLC),,European Journal of Cancer,,,49.0,0.0,1/1%3/0@@1,@@-,{V. HirshJ.Y. HanF. BlackhallS. IyerD.W. KimA. ShawA. ReismanK. WilnerH. NokiharaB. Besse}
787,724055.0,,English,Indian Journal of Psychiatry,,,56.0,0.0,1/14/01,29-38,{S. SarkarS. Grover}
788,63738.0,[The use of ethonium paste in the treatment of deep dental caries]%.,rus,Stomatologiia,Stomatologiia (Mosk),0039-1735,,2.0,,,{P K Shestakov}
789,,,eng,BMC medicine,BMC Med,1741-7015,8.0,0.0,1/10/01,20-20,{Patrick RoystonRachel WatersSusan MallettDouglas G AltmanSusan Dutton}
790,97795.0,Hospital discharge after ambulatory knee arthroscopy: a comparison of epidural 2-chloroprocaine versus lidocaine,,,,,26.0,1.0,1/1/01,35-40,{J. M. NealD. J. KopaczM. A. LewisJ. J. Deck}
791,155127.0,,eng,Oral surgery oral medicine oral pathology and oral radiology,Oral Surg Oral Med Oral Pathol Oral Radiol,2212-4411,,6.0,1/14/12,,{Lucio MontebugnoliLuca MorandiLuca ScapoliAnnalisa PalmieriDavide B GissiMaria Pia FoschiniIlaria Manelli}
792,100986.0,,ENG,Journal of cardiovascular medicine (Hagerstown Md.),J Cardiovasc Med (Hagerstown),1558-2035,,-1.0,9/23/14,,
793,166179.0,[Severe exposure to environmental lead in a child population in Antofagasta Chile],,Exposicion severa a plomo ambiental en una poblacion infantil de Antofagasta Chile.,,0034-9887,128.0,2.0,#1/1/00,221-32,
794,,,,Critical Care Nurse,,,33.0,5.0,1/13/01,18-31 14p,{L#inda L. MorrisAndrea WhitmerErik McIntosh}
795,379577.0,Monitoring of fluid changes in hospitalized Malnourished Guatemalan children using bioelectrical impedance spectroscopy (BIS).,eng,Applied radiation and isotopes : including data instrumentation and methods for use in agriculture industry and medicine,Appl Radiat Isot,,49.0,5.0,5/1/98%,615-7,{C PithanM MazariegosN W SolomonsP F_rst}
