ID,id,article_title,article_language,journal_title,jounral_abbreviation,journal_issn,article_jvolumn,article_jissue,article_jcreated_at,article_pagination,author_list
1,235295.0,Late repair of injuries of the anal sphincter,eng,,Proceedings of the Royal Society of Medicine,,64.0,12.0,,1187-9,{A. G. ParksJ. F. McPartlin}
2,498345.0,Ebola Virus GP Gene Polyadenylation Versus RNA Editing.,ENG,The Journal of infectious diseases,J. Infect. Dis.,1@@537-66%13,,-1.0,2/15/0@@4,,{Valentina A VolchkovaJaroslav VoracPhilip LawrenceLaurie Repiquet-PaireViktor E Volchkov}
3,789958.0,Duane retraction syndrome associated with oculocutaneous albinism: an ocular miswiring.,eng,Indian journal of ophthalmology,Indian J Ophthalmol,0301-4738,54.0,4.0,1/6/12,283-4,{Jitendra JethaniShashikant ShettySucheta ParijaP Vijayalakshmi}
4,903246.489164657,[Noninvasive prenatal diagnosis of trisomy 21 18 and 13 using cell-free fetal DNA],pol,,,,84.0,0.0,1/13/01,714-9 ST  - [Noninvasive prenatal diagnosis of trisomy 21 18 and 13 using cell-free fetal DNA]-,{G. JakielK. GorzelnikJ. G. ZimowskiT. CN  - PubMed DA  - Aug DP  - NLM ET  - 2013/11/07 RoszkowskiJ. Bijok}
5,803653.0,Diagnosis and Management of Cutaneous B-cell Lymphoma.,,Dermatologic clinics,Dermatol Clin,1558-0520,,4.0,1/15/10,835-40,{Lauren C Pinter-Brown}
6,98234.0,Pregabalin celecoxib and their combination for treatment of chronic low-back pain,,,,,58.96368740962522,4.0,1/9/01,185-91,{C. L. RomanoG. MineoC. BonoraD. Romano}
7,823730.0,Activation and blockade of beta adrenoceptors in common cardiac disorders,eng,Br Med Bull,British medical bulletin,0007-1420,29.0,8.279039749059418,1/1/73,163@@-??7,{B N PrichardJ W Black}
8,729712.0,Long-term effects of spontaneous breathing during ventilatory support in patients with acute lung injury,English; ABSTRACT LANGUAGE:English,American journal of respiratory and critical care medicine,,,164.0,1.0,1/1/07,,
9,396821.0,Awareness of deficits and on-road driving performance,English,Clinical Neuropsychologist,,1385-4046,25.0,7.0,1/11/01,1158-78,{L. J. RapportJ. A. GriffenL. A. BieliauskasC. BurtR. C. Bryer}
10,1930434.5699183405,,,,,,79.0,938.0,1/6/01,158-61,{K. FlemingK. DonatoK. Leszczynski}
11,184417.0,Disparities in childhood asthma hospitalizations: A spa#tial analysis of contextual effects,,Transportation Research Part D-Transport and Environment,,1361-9209,14.0,5.0,1/9/01,317-325,{J. L. LiP#. Newcomb}
12,729686.0,Local anaesthetic wound infiltration used for caesarean section pain relief: a     meta-analysis,English,International journal of clinical and experimental medicine,Int J Clin E?#?xp Med,1940-5901,,6.0,1/15/01,10213-10224,{Yang MLi JLi YZhou MYang HShi XLi XYuan H}
13,278396.0,Smoking is accompanied by a suppressed cervical nitric oxide release in women with high-risk human papillomavirus infection,eng,Acta Obstet Gynecol Scand,Acta obstetricia et gynecologica Scandinavica,0001-6349 (Print) 0001-6349,276.8075034455347,6.0,1/13/01,71??1-5,
14,965082.0,Imaging of scar in patients with ventricular arrhythmias of right ventricular origin: Cardiac magnetic resonance versus electroanatomic mapping,,Hea%rt Rhythm,,1547-5271,8.0,5.0,1/11/01,S40,{C. Hamilton-CraigS. BartolettiM. CasellaF. PernaM. L. NarducciP. SantangeliF. PintusA. NataleA. Dello RussoG. PelargonioG. BencardinoJ. D. BurkhardtF. BellocciL. Di Biase}
15,,Monoaxial versus polyaxial locking systems: a biomechanical analysis of different locking systems for the fixation of proximal humeral fractures,,,,,175.46130067764415,8.0,1/11/01,1245-50,{T. ToppC. KuhneS. RuchholtzU. LewanA. KrugerT. MullerR. Zettl}
16,13601.0,Latex allergy in atopic children.,e??n#g,British Journal of Der%matology. ,,0007-0963,140.0,19.948985638831104,5/1/99,,{R S LeverS A Holme}
17,668310.0,A randomized controlled trial of Tai chi for balance sleep quality and cognitive performance in elderly Vietnamese.,eng,,Clin Interv Aging,,7.0,-1.0,1#/12/01,185-90,{Andreas KruseManh Hung Nguyen}
18,1066658.8696898175,Multisystemic Therapy for social emotional and behavioral problems in youth aged 10-17,eng,Cochrane Database Syst Rev,,1469-493X,,,1/5/01,Cd004797,{J. H. LittellM. PopaB. Forsythe}
19,478292.0,,eng,Acta Neurochirurgica,,Jan-??6@@8,139.0,3.0,1/1/97,257-8,{Y TakagiN HashimotoY Goto}
20,43736.0,Effect of pedaling technique on mechanical effectiveness and efficiency in cyclists.,eng,Medicine and science in sports and exercise,Med Sci Sports Exerc,0195-9131,39.0,,1/7/06,991-5,{James C MartinIan MayhewLee M RomerThomas Korff}
21,82614.0,Lycopene metabolite apo-10'-lycopenoic acid inhibits diethylnitrosamine-initiated high fat diet-promoted hepatic inflammation and tumorigenesis in mice.,eng,Cancer prevention research (Philadelphia Pa.),Cancer Prev Res (Phila),1940-6215,6.0,12.0,1/13/12,1304-16,{Lynne M AusmanMartin S ObinXiang-Dong WangChun LiuBlanche C IpDonald E SmithKang-Quan Hu}
22,163526.0,,English,,,,40.0,0.0,,512-9 ST  - A performance improvement process to tackle tachysystole-,{V. E. CN  - medline DA  - Sep-Oct DB  - MEDLINE DO  - http://dx.doi.org/10.1111/j.1552-6909.2011.01275.x DP  - Ovid Technologies von GruenigenA. M. BurkettJ. DoyleT. H. Kenny}
23,514411.0,,eng,Cardiovascular and intervention#al radiology,Cardi%ovasc Intervent Radiol,1432-086X,167.8689713228376,6.0,%1/14/%12,,{Luca Maria SconfienzaEzio LanzaGianpaolo CornalbaDario PorettiCatherine CytevalPierre VialaFrancesco SardanelliYann Thouvenin}
24,569841.0,Effects of chemotherapy in AIDS-associated non-Hodgkin's lymphoma on Kaposi's sarcoma herpesvirus DNA in blood.,,Journal of clinical oncology : official journal of the American Society of Clinical Oncology,,1527-7755,27.0,15.0,5/20/09,2496-502,{Ariela NoyLawrence D KaplanYanxing YuAlexandra M LevineRichard F AmbinderSusan E KrownBruce J DezubeLan LinJeannette Y LeeGary S Hayward}
25,,,,Scandinavian Journal of Gastroenterology,,,,29.592754904222616,1/12/01,785-794,
26,21910.0,Examining waiting placement in hospital: utilization and the lived experience.,eng,Global journal of health science,Glob J Health Sci,1916-9736,6.0,2.0,1/14/03,,{Donna M WilsonJessica A HewittRalph MagnusJill VihosKaren PetersonNancy Barnes}
27,378490.0,A prospective observational study of obesity body composition and insulin resistance in 18 women with bipolar disorder and 17 matched control subjects.,eng,The $Journal of clinical psyc??hiatry,J Clin Psychiatry,1555-2101,69.0,12.0,,1892-900,{Isabella SorecaAndrea FagioliniDavid J Ku%pferBret H GoodpasterSara B Fleet-MichaliszynAmy D OttoJohn M Jakicic}
28,971878.0,Diminished A-cell secretion in the early phase of type I diabetes mellitus,,Metabolism: Clinical and Experimental,,,35.0,11.0,1/1/86,1074-1077,{S. SrikantaO. P. GandaR. E. Gleason}
29,4644945.582279795,Strong stability and$ host specific bacterial# community in faeces of ponies.,eng,PLoS One,,1932-6#203,,9.0,1/13/01,e75079,{Tina M BlackmoreKirsty DougalHilary J WorganEric PinlocheGemma CurtisC Jamie NewboldNeil R McEwanSusan E GirdwoodPat A HarrisCaroline McG ArgoAlex Dugdale}
30,819166.0,Responses to open peer commentaries on the subjective brain identity and neuroethics,English,American Journal of Bioethics,,,9.0,9.0,,W1-W4@$@,{G.R. Gillett}
31,,[A case of giant?? Brunner's gland hyperplasia combined with adenomyomatous hyperplasia]$.,,The Korean journal of gastroenterology = Taehan Sohwagi Hakhoe chi,Korean J Gastroenterol,1598-9992,52.0,6.0,1/8/12,38$4-8,{Seung Woo ParkJae Bock ChungSang Kyum KimSi Young SongJoo Won ChungHo Keun KimJoo Hee SeoSeungmin Bang}
32,629530.0,Efficacy and safety of the low-molecular weight heparin enoxaparin compared with unfractionated heparin across the acute coronary syndrome spectrum: a meta-analysis.,en????g,Eur. Heart J.,,0195-668X,28.0,17.0,1/7/09,2077-86,
33,954388.0,Optimal Starting Age for School Attendance: FY76 Issue Analysis,,,,,0.0,,1/1/74,46,{Marilou Madden}
34,2176577.2288867873,Bone density and body composition in young women with chronic fatigue syndrome.#,??eng#,Neuroprotective Agents,,0077-8923,4326.855769017313,-1.0,5/1/00,625-7,
35,676042.0,Prognostic value of morning blood pressure surge in clinical events: a meta-analysis of longitudinal studies.,eng,,,??1532-8511,24.0,9.533837922711108,1/15/02,362-9,{Yan-Xin ZhaoJun-Chao XieXue-Yuan LiuHan @@Yan}
36,353972.0,Child sexual abuse as a risk factor for sexual risk behaviours among socially disadvantaged adolescents in Ibadan Nigeria.,,Vulnerable Children and Youth Studies,,1745-0128 1745-0136,3.0,3.0,1/8/01,243-$24$8,{B O Olley}
37,,,,Respiration; international review of thoracic diseases,Respiration,,88.0,,1%/14/01,144-147,{T. NakajimaI. YoshinoK. YasufukuS. YoshidaY. SakairiK. Shibuya}
38,660168.0,Fat and neurosurgery: does obesity affect outcome after intracranial surgery?,eng,,Neurosurgery,1524-4040,64.0,2.0,1/9/02,316-26; %disc??ussion 326-7,{R Loch MacdonaldFarbod Asgarzadie-GadimYeon Gyoe JangDaniel J CurryRachel N YanowitchKim E SchultheissJocelyn TolentinoJ_rgen L_ders}
39,,Out of harm's way: curbing violence in the ED,Engl@@ish,,Health Facil Manage,,8.0,10.0,1/1/95,20-6 28,{K. Sandrick}
40,,The incidence of contrast-induced nephropathy in trauma patients.,en??$g,European journal of emergency medicine : official journal of the European Society for Emergency Medicine,Eur J Emerg Med,,15.0,3.0,,134-9,{Rich SinertShoma DesaiAntonia H#ippCarmen Lopez}
41,1120787.12656898,Dosimetric analysis of proton pencil beam scanning radiation therap@@y versus dose painted intensity modulated radiation therapy for squamous cell carcino$ma of the anal canal,,,,0360-3016,,5.311085733864951,,S398,{Kooy H.Hong T.S.Symonifka J.Depauw N.Wo J.Y.}
42,628387.11367444,Brain BDNF levels elevation induced by physical training is reduced after unilateral common carotid artery occlusion in rats.,eng,Journal of cerebral blood flow and metabolism : official journal of the International Society of Cerebral Blood Flow and Metabolism,J. Cereb. Blood Flow Metab.,1559-7016,34.0,,1/14/$1$0,1681-7,{Jacques Van HoeckeHayat BanoujaafarChristine MarieClaude M Mossiat}
43,330553.0,Multiresistance of clinically relevant gram-positive cocci,,Intensivmedizin und Notfallmedizin,,0175-3851,34.0,7.0,1$/??1/97,,{G. PetersK. BeckerC. Von Eiff}
44,23215.0,ColoRectal Cancer Predicted Risk Online (CRC-PRO) calculator using data from the Multi-Ethnic Cohort Study.,eng,Journal of #the ??American Board of Family Medicine : JABFM,J Am Board Fam Med,1557-2625,27.0,1.0,1/14/01,42-55,{Leila JacksonBrian J WellsGregory S CooperSiran KoroukianMichael W Kattan}
45,719532.0,Methodology to estimate building energy consumption using EnergyPlus Benchmark Models,,Energy and Buildings,,0378-7788,42.0,12.0,1/10/01,2331-2337,{R. LuckP. MagoN. Fumo}
46,86421.0,Evidence that serum levels of the soluble receptor for advanced glycation end products are inversely associated with pancreatic cancer risk: a prospective study.,eng,Cancer research,,1538-@@74@@45,71.0,10.0,5/15/11,,{Stephanie J WeinsteinRachael Z Stolzenberg-SolomonPhilip R TaylorBarry I GraubardJarmo VirtamoDemetrius AlbanesLi Jiao}
47,,Norton Waterlow and Braden scores: a review of the literature and a comparison between the scores and clinical judgement,,,,,0.0,0.0,,,{NULL}
48,530323.0,Strategies for partner notification for sexually transmitted infections including HIV.,e??n@@g,Cochrane Database Syst. Rev.,,1??469-49#3X,10.0,,1/13/01,CD002843,{Catherine MathewsMoleen ZunzaAdel FerreiraNicola LowTaryn Young}
49,102893.0,A cohort study of the prevalence and impact of comorbid medical conditions in pediatric bipolar disorder.,eng,The Journal of clinical psychiatry,J Clin Psychiatry,1555-2101,71.0,,,1518-25,{Roger S McIntyreAvnish TripathiJeanette M Jerrell}
50,3748752.198650506,Are tkis still active in patients treated with tki and everolimus? Experience from 36 patients treated in france in the record 1 trial,,Annals of Oncology,,,21.0,0.0,1/10/01,viii284,{B. EscudierA. RavaudF. RollandA. BlesiusB. BeuzelinkS. OudardC. Chevreau}
51,217725.0,Use of alendronate in peri-implant defect regeneration,English,,,,70.0,2.0,1/1/99,,{P. C. WollanS. J. MerawC. M. Reeve}
52,730822.0,Prevention of phantom pain after major lower limb amputation by epidural infusion of diamorphine clonidine and bupivacaine,English; ABSTRACT LANGUAGE:English,Annals of the Royal College of Surgeons of England,Ann R Coll Surg Engl,0035-8843,76.0,5.0,1/1/94,324-326,{Jayatun@@ga APDark CHJahangiri MBradley JWP}
53,659297.0,How assistive technology use by individuals with disabilities impacts their caregivers: a systematic review of the research evidence.,,,Am J Phys Med R@@ehabil,1537-7385,91.0,,1/12/11,984??-9@@8,{James LenkerW Ben MortensonFrank DeRuyterLouise DemersJeffrey W JutaiMarcus J Fuhrer}
54,42247.0,Gender differences in personal social and environmental influences on active travel to and from school for Australian adolescents.,eng,Journal of science and medicine in sport / Sports Medicine Australia,J Sci Med Sport,1878-1861,13.0,6.0,1/10/11,597-601,{John W ToumbourouEva LesliePeter KremerJoanne W Williams}
55,302969.0,Adolescent overscheduling: The relationship between levels of participation in scheduled activities and self-reported clinical symptomology,,,,,90.0,3.0,1/7/01,18-30,{Steven G LittleK Angeleque Akin-LittleShari Melman}
56,158672.0,Qua%ntitative Analysis of Robustness of Dynamic Response and Signal Transfer in Insulin @@mediated PI3K/AKT Pathway.,,Computers & chemical engineering,Comput Chem Eng,,398.39655933538734,-1.0,4/14/12,,{Shibin MathewIpsita Banerjee}
57,,,eng,Journal of clinical anesthesia,,0952-8180,18.0,6.0,1/6/09,,{David N MaineGenevieve E CourpasJames F WellerJeffrey M RichmanAndrew J RowlingsonChristopher L Wu}
58,221086.0,Novel genetic linkage of rat Sp6 mutation to Amelogenesis imp??erfecta,eng,,,,7.0,0.0,1/12/01,34,{K. MiyoshiT. NomaT. MutoH. HagitaT. Horiguchi}
59,,Educating Emergent Bilinguals: Policies Programs and Practices for English Language Learners. Language & Literacy Series,,Teachers College Press,,0-8077-4913-3,0.0,0.0,1/10/10,,{Ofelia GarciaJo Anne# Kleifgen}
60,669596.0,Similar survival between uncemented and cemented fixation prostheses in total knee arthroplasty: a meta-anal#ysis and systema%tic comparative analysis using registers.,eng,Knee surgery sports traumatology arthroscopy : official journal of the ESSKA,Knee Surg Sports Traumatol Arthrosc,1433-7347,22.0,12.0,1/14/12,Jul-91,{Junwei JiangHongchuan WangHua LouKai LiuHuiwei Zhang}
61,474288.0,Current palliative chemotherapy trials in the elderly neglect patient-centred outcome measures.,,Journal of geriatric oncology,J Geriatr Oncol,1879-4076,6.0,1.0,1/15/01,15-22,{Marlies L van BekkumBarbara C van MunsterMarije E HamakerCarolien H SmorenburgPeter L M Thunnissen}
62,108424.0,,eng,Obesity surgery,Obes Surg,,12.0,2.0,,261-4,{Ryan HolzwarthBasir TareenAlicia MajkrzakDarren Huber}
63,841679.0,A Modified Techniq#ue f#or Pulmonary Valve Replacement with a Homograft,English,J. Card. Surg.%,,-7977,26.0,,1/11/01,144-147,{S. K. ChoudharyG. S. GulatiP. SharmaS. TalwarB. AiranS. Mishra}
64,173830.0,Advances in allergic skin disease anaphylaxis and hypersensitivity reactions to foods drugs and insects,,Journal of Allergy and Clinical Immunology,,0091-6749 (Print),116.0,1.0,,153%-1@@63,
65,852927.0,Phase II study of epirubicin oxaliplatin and docetaxel combination in metastatic gastric or gastroesophageal junction adenocarcinoma.,eng,J. Exp. Clin. #Ca%ncer Res.,,17$56-9966,28.0,,1/9/01,34,{Laura GiacintiSilvia Ileana FattorusoMaria Grazia ArenaLuigi Di LauroMassimo LopezDomenico SergiDiana Giannarelli}
66,1319259.9643620816,Neck pa%in$.,eng,Clinical evidence,Clin Evid (On%li#ne),1752-8526,2008.0,1.0,1/8/01,,{Allan I Binder}
67,912884.0,A guide to physio$therapy in cerebral palsy,,Paediatrics and Child Health,,,18.0,0.0,1/8/01,,{C. E. Barber}
68,1419595.7962562202,Community associated methicillin-resistant Staphylococcus aureus in HIV-infected patients,,AIDS Reviews,,1139-6121,65.96689910005293,3.0,1/10/01,153-163,{M. PujolP. BarragnJ.M. TiraboschiA. ImazM.. Dom_nguezD. Podzamczer}
69,93659.0,,,Sheng wu yi xue gong cheng xue za zhi = Journal of biomedical engineering = Shengwu yixue gongchengxue zazhi,Sheng Wu Yi Xue Gong Cheng Xue Za Zh@@i,1001-5515,29.0,,1/12/06,4@@53-5 459,
70,349150.0,The relationship between capsulorhexis size and anterior chamber depth relation.,eng,Ophthalmic surgery and lasers,Ophthalmic Surg Lasers,,30.0,3.0,3/1/99,185-90,{O Ceki_C Batman}
71,572010.0,A pilot study of rituximab in patients with recurrent classic Hodgkin disease.,eng,CANCER,,0008-543X,98.0,2.0,7/15/03,310-4,{Anas YounesL Jeffrey MedeirosFrederick HagemeisterMaria Alma RodriguezSima JehaPaolo FiumaraLynne V AbruzzoJohn T ManningJorge RomagueraAndre GoyDan JonesPeter McLaughlin}
72,826030.0,A cognitive behavior intervention program in women with unexplained chest pain--a pilot study,e#ng,European journal of cardiovascular nursing : journal of the Working Group on Cardiovascular Nursing of the European Society of Cardiology,Eur J Cardiovasc Nurs,1474-5151,11.0,,1/12/01,183-9,{Cecilia Bj_rkelund$Margaretha Jerlock}
73,34962.0,Assessing social isolation in motor neurone disease: a Rasch analysis of the MND Social Withdrawal Scale.,eng,Journal of the neurological sciences,J. Neurol. Sci.,1878-5883,,1.0,11/15/13,112-8,
74,574309.0,,English,Transplantation,Transplantation,,99.0,,1/15/01,1455-1462,{Junge GRauer BDe Simone PFischer LDe Carlis LKaiser GMSaliba FDuvoux CMetselaar HJDong GNevens FFung JJ}
75,200077.0,Plasma cell leukemia--a case report.,eng,Indian Journal of Pathology and Microbiology,,,138.18877858097613,3.0,1/3/07,484-7,{T K DuttaPampa Ch ToiBhawana A BadheL H GhotekarDebdatta Basu}
76,421512.0,CABG again outshines stenting for some patients with coronary artery blockage,eng,,,,309.0,1.0,1/13/01,,{M. Mitka}
77,715052.0,,,,,,25.0,3.0,1/11/01,118-124 7p$,
78,172966.0,Food allergy in children,,Arch@@ives De Pediat??rie,,0929-693X,13.0,10.0,,1349-1353,{E. Bidat}
79,140274.0,Here to stay. An interview with Dr. David Satcher Director U.S. Centers for Disease Control and Prevention.,eng,Nepal Medical College journal : NMCJ,Nepal Med Coll J,,1.0,17.0,11/1/96,9-Jun,{J Stilkind}
80,282039.0,The first case of drug-induced immune hemolytic anemia due to hydrocortisone,,Transfusion,,0041-1132,48.0,,1/8/01,1925-1929,{M. MartinengoD. F. ArdenghiG. RealiG. Tripodi}
81,835177.0,KRAS mutational status assessment in patients with metastatic colorectal cancer: are the clinical implications so clear?,,Eur J Cancer Care (Engl),,096$1-5423 (Print) 0961-5423,19.0,2.0,1/10/01,167%-??71,{M. HebbarP. FournierO. Romano}
82,,Classifying ra@@diographic progression status in early rheumatoid arthritis patients using propensity #scores to adjust for baseline differences.,eng,Statistical methods in medical research,Stat Methods Med Res,0962-2802,16.0,,1/7/02,13-29,{John T SharpWeng Kee WongGrace S ParkHarold E PaulusMyungShin OhRichard H GoldDinesh Khanna}
83,761104.0,Infusing Tolerance Diversity and Social Personal Curriculum into Inclusive Social Studies Classes Using Family Portraits and Contextual Teaching and Learning,,TEACHING Exceptional Children Plus,,,1.0,3.0,,,{Milagros# M. SessionsKevin J. Miller}$
84,1622727.8413335038,Adherence to fesoterodine in women with overactive bladder in routine clinical practice.,engspa,Actas urologicas espanolas,Actas Ur#ol@@ Esp,1699-7980,39.0,4.0,,222-8,{E HuguetO PortaE Mart_nezI MoraM Sim_J PubillJ A OrtegaM T Castillo}
85,889481.0,Chronic pain related to $quality of s@@leep,eng     por,Einstein (Sao Paulo),Einstein (Sao Paulo Brazil),1679-4508,67.29579474287783,2.0,1/14/01,159-63,{W. HummigJ. Stechman NetoL. F. Tonial}
86,4160675.2708381177,,,Proc. iEMSs 4th Biennial Meeting - Int. Congress on Environmental Modelling and Software: Integrating Sciences and Information Technology for Environmental Assessment and Decision Making iEMSs 2008,,,3.0,0.0,1/8/01,1937-1958,{Miquel S_nchez-MarrGeoff HolmesJoaqu_n IzquierdoJoaquim ComasIoannis AthanasiadisKarina Gibert}
87,604985.0,Cardioactive steroid poisoning: a comparison of plant- and animal-derived compounds.,,J Med Toxicol,Journal of medical toxicology : official journal of the American College of Medical Toxicology,1556-9039,2.0,4.0,1/##6/12,152-5,{Robert S HoffmanBrian W CotterBarbara M KirraneFermin BarruetoLewis S Nelson}
88,220950.0,,eng,,,,4.0,1.0,,38-41,{S. GosaviS. Gosavi}
89,770196.0,FIGO staging of gynecologic cancer. 1994-1997 FIGO Committee on Gynecologic Oncology. International Federation of Gynecology and Obstetrics,eng,Int J Gynaecol Obstet,International journal of gynaecology and obstetrics: the official organ of the International Federation of Gynaecology and Obstetrics,002@@0-7292,64.0,1.0,1/1/99,10-May,
90,914468.0,Effect of neuromuscular electrical stimulation and isotonic exercises in flexor and extensor muscles of knee of hemiplegic patients,,Revista de Neurologia,Rev.Neurol.,0210-0010,46.0,3.0,1/8/01,135-138,{S. Regina-R%ibeiroC. TortozaR. P. S. LimaS. T. T. de FreitasP. R. LucareliM. O. LimaM. T. PachecoJ. Gomes-LucareliR. A. Lopes-Martins}
91,,Ventricular fibrillation in acute mitral valve insufficiency caused by chordae tendineae rupture: report of a surgically corrected case.,,J Cardiovasc Med (Hagerstown),Journal of cardiovascular medicine (Hagerstown Md.),1558-2027,,3.0,1/9/03,261-3,{Giovanni Teodori%Marta LeveroneEraldo Occ$hettaMiriam BortnikPaolo MarinoMarco Marcolongo}
92,,,fre,Pathologie non allergique et exposition aux moisissures domestiques.,,,,1.0,1/10/01,Jul-93,{B H Mbatchou NgahaneG DevouassouxH BaudrandB GuibertN FreymondY PachecoA Traverse-Glehen}
93,,,,,Nicotine & tobacco research : official journal of the Society for Research on Nicotine and Tobacco,1462-2203,1.0,4.0,1/1/99,341-6,{M. W. MartinR. SaundersS. Levin}
94,,Intimate Partner Violence Survivors' Unmet Social Service Needs,English,Journal of Social Service Research,,1540-7314 0148-8376,37.0,5.0,1/11/01,481-489,
95,417578.0,Partial fill strategies for oral oncolytics to reduce waste and drive persistency,eng,Am J Manag Care,The American journal of managed care,1088-0224,19.0,1.0,1/13@@/01,SP26-7,{A. A. Kaddis}
96,949067.0,The impact of advancing age on P-glycoprotein expression and activity: current knowledge and future directions,,Expert Opi@@n Drug Metab %Toxicol,Expert opinion on drug metabolism & toxicology,1742-5255,3.0,3.0,1/7/01,315-20,{A. A. Mangoni}
97,3970500.107376598,Prevalence of allergic diseases in Poland - ECAP study,,Allergy: European Journal of Allergy and Clinical Immunology,,,64.0,0.0,,326-327,
98,752456.0,,,%J Dent Res,Journal of dental research,0022-0345,71.0,5.0,1/1/92,,{$B. A. Burt}
99,377284.0,Normal insulin sensitivity and IMCL content in overweight humans are associated with higher fasting lipid oxidation.,eng,Am J Physiol Endocrinol Metab,American journal of physiology. Endocrinology and metabolism,0193-1849,283.0,3.0,1/2/09,E556-64,{Paola ScifoAlessandro Del MaschioLivio LuziElena MeneghiniAlberto BattezzatiGianluca PerseghinMassimo DannaStefano Benedini}
100,,,,,J Am Diet Assoc,,92.0,3.0,1/1/92,3$19-324,{Stensland SHSobal J}
101,444273.0,Iatrogenic perforation at colonic imaging.,,,,,,0.0,,,{NULL}
102,816680.0,,,Cognitive Processing,,1612-4782     1612-4790,,,1/14/01,283-296,{M. Tercedor SnchezJ.A. Prieto Velasco}
103,491006.0,,English,,,,24.0,2.0,1/15/01,,{A. KelirisI. KoutsourelakisA. MinaritzoglouS. Zakynthinos}
104,628299.0,Risk of gestational diabetes mellitus in women with polycystic ovary syndrome: a systematic review and a meta-analysis.,,Fertility and sterility,Fertil. Steril.,1556-5653,92.0,,1/9/08,667-77,{Christos A VenetisBasil C TarlatzisKonstantinos A ToulisEfstratios M KolibianakisDimitrios G GoulisIoannis Papadimas}
105,72089.0,Clinical pharmacokinetics of Icotinib an anti-cancer drug: evaluation of dose proportionality food effect and tolerability in healthy subjects.,eng,Cancer chemotherapy a$nd pharmacology,Cancer Chemother. Pharmacol.,1432-0843,73.0,4.0,1/14/04,721-7,{Fenlai TanJi JiangDon ZhangDongyang LiuYingxiang WangLi ZhangPei Hu}
106,847287.0,A qualitative exploration of the cancer experience among long-term survivors: comparisons by cancer type ethnicity gender and age.,eng,Psycho-oncology,Psychooncology,1057-9249,15.0,3.0,1/6/03,248-58,
107,764224.0,High intensity interval exercise training in overweight young women,,,,,194.14521725762341,3.0,1/12/01,255-62,{Y. FengyingY. HainaiW. JianxiongT. Sijie}
108,591619.0,Effect of antibiotic prescribing in primary care on meticillin-resistant Staphylococcus aureus carriage in community-resident adults: a controlled observational study,eng,,,,39.0,2.0,1/12/01,135-41,{A. D. HayA. LoveringC. CostelloeA. MontgomeryD. LewisC. McNulty}
109,125072.0,Ghrelin improves left ventricular dysfunction and cardiac cachexia in heart failure.,eng,Current opinion in pharmacology,Cur%r Opin Pharmac$ol,1471-4892,3.0,2.0,1/3/04,146-51,{Nori??toshi Nagay@@aKenji Kangawa}
110,255432.0,Pool fencing for preventing drowning in children.,eng,The Cochrane Database Of Systematic Reviews,Cochrane Database Syst Rev,1469-493X,-1.0,2.0,1/1/00,CD001047,{D C ThompsonF P Rivara}
111,689284.0,Intrinsically% de-sialylated CD103(+) CD8 T cells mediate beneficial anti-glioma immune response%s.,eng,Cancer immunology immunotherapy : CII,Cancer Immunol. Immunother.,1432-0851,63.0,9.0,1/14/09,911%@@-24,{HongQiang WangDwain K IrvinAshley GraggXiao-xue ZhangChristopher J WheelerKeith L BlackLucia VeigaRyan CordnerMandana ZandianAkanksha PanwarEmmanuel JouanneauYuying ZhaiShyam GoverdhanaArmen Mardiros}
112,781141.0,Mind the Gap: Difference between Fram#ingham heart age and real age increase#s with age in HIV-positive individuals - A clinical cohort study,English,,,2044-6055,3.0,10.0,,,{T. L. DaviesB. BovillS. JohnstonM. T. MayM. Gompels}
113,148787.0,Cardiac atrophy in women following bed rest,eng,,,,103.0,0.0,1/7/01,,
114,779281.0,,,Industrial Robot: An International Journal,,0143-991X,38.0,4.0,1/11/01,,{NULL}
