ID,id,article_title,article_language,journal_title,jounral_abbreviation,journal_issn,article_jvolumn,article_jissue,article_jcreated_at,article_pagination,author_list
232,504206.0,Tropical infection after a case of total hip arthroplasty.,eng,The Journal of hospital infection,J. Hosp. Infect.,1532-2939,87.0,3.0,1/14/07,179-81,{E SennevilleH MelliezV LoviC JosephM DouaudM PradierT BoyerA MeybeckL Fortin-Lebraud}
233,800900.0,Chronic pelvic pain.,eng,Best practice & research. Clinical gastroenterology,Best Pract Res Clin Gastroenterol,1532-1916,23.0,4.0,1/9/01,593#-610,{Andrew Paul Baranowski}
234,235689.0,Obstetrical anal sphincter laceration and anal incontinence 5-10 years after childbirth,,,American journal of obstetrics and gynecology,0002-9378 (Prin#t#) 0002-9378,207.0,5.0,1/12/01,425.e1-6,{K. C. McDermottJ. L. BlomquistV. L. HandaE. C. Evers}
235,659896.0,Comparative effectiveness of instructional design features in simulation-based education: systematic review and meta-analysis.,e%ng$,Medical teacher,Med T@@each,1466-187X,35.0,1.0,1/13/01,e867-98,{Benjamin ZendejasStanley J?? HamstraRose HatalaDavid A CookAmy T WangJason H SzostekPatricia J ErwinRyan Brydges}
236,84944.0,Body mass index and outcome of ASC-H-interpreted cervical smears in postmenopausal women.,eng,Acta cytologica,Acta Cytol.,Jan-47,56.0,3.0,1/12/01,259-65,{Jae Jun LeeSang Yong SongSoomin AhnYoung Lyun OhJi-Youn SungChang Ohk SungYoo-Young Lee}
237,1946800.982091454,Plasma concentration of asymmetric dime%thylarginine and the risk of coronary heart disease: rationale and design of the multicenter CARDIAC study.,eng,,Atheroscler Suppl,1567-5688,4.0,4.0,1/3/12,29-32,{Andreas M_ggeChristoph HanefeldRainer H B_ger[Collective Name] CARDIAC study investigators}
238,922795.0,[Tox@@icology and clinical significance of base-catalized degradation of sevoflurane to Compound A].,ger,Schlafst_rungen bei kritisch kranken patienten,,17-Mar,45.0,-1.0,2/1/96,S10-3,{R M JonesP Conzen}
239,768486.0,Functionality and feedback: a protocol for a realist synthesis of the collation interpretation and utilisation of PROMs data to improve patient care,eng,BMJ O%pen,,,,7.0,1/14/01,e00??5601,{C. MillsS. DalkinJ. GreenhalghC. WoodL. WoodJ. WrightE. GibbonsN. BlackJ. M. ValderasR. PawsonD. Meads}
240,428363.0,,eng,Mycoses,Mycoses,0933-7407,44.0,9.0,1/1/11,419-%21,{L RamosS Mathur_nA MateoC L_pezC G_mez}
241,519287.0,,eng,BMC Musculoskelet Disord,BMC musculoskeletal disorders,,8.0,-1.0,1/7/01,,{Glen M BlakeTim D SpectorIgnac FogelmanUsha Chinappen-Horsley}
242,638918.0,Imaging for target volume delineation in rectal cancer radiotherapy--a systematic review.,e@@n@@g,Clinical Oncology (Royal College o@@f Radio$logists),,1433-2981,24.0,1.0,1/12/02,52-63%,{R WebsterE SpeziS MukherjeeR AdamsS GwynneJ StaffurthB Coles}
243,111336.0,The influence of smoking and impaired glucose homoeostasis on the outcome in patients presenting with an acute coronary syndrome: a cross-sectional study.,eng,BMJ Open,,,4.0,,%@@1/14/01,,{Anders HallingHkan OdebergHenrik ForssellJacob OdebergMarie-Louise PerssonLennart RstamIvar VaaraUlf LindbladMichael Freitag}
244,747279.0,Systematic review exploring the effect of exercise in pulmonary rehabilitation on depression levels in patients with chronic obstructive pulmonary disease,,,Physiotherapy,1873-1465,97.0,0.0,,eS502-eS503,{Patil S.Horobin H.}
245,,,eng,Public health genomics,Public Health Genomics,1662-8063,,4.0,,159-73,
246,258108.0,Impact of seasonality on recruitment retention adherence and outcomes in a web-based smoking cessation intervention: randomized controlled trial,,,,,15.0,0.0,1/13/01,e249-,{Mushro ANiaura R SGraham A LCobb N KFang YCha S}
247,59308.0,White matter diffusivity predicts memory in patients with subjective and mild cognitive impairment and normal CSF total tau levels.,eng,Journal?? of the International Neuropsychological Society : JINS,J Int Neuropsychol Soc,1469-7661,16.0,1.0,1/10/01,,
248,610641.0,Comparison between open and closed suction systems: a systematic review.,ENGPOR,Revista Brasileira de terapia intensiva,Rev Bras Ter Intensiva,1982-4335,,4.0,#1/%8/12,,{Luiz Rogrio de Carvalho OliveiraNilza Aparecida Almeida de CarvalhoFlvio C L Cavalcanti A%ra_joIzabela Menezes PagottoPaulo C@@hiavone}
249,631704.0,Association between interleukin-10 promoter polymorphisms and endometriosis: a meta-analysis.,eng,Gene,,,2049.413211830778,1.0,2/15/13,49-55,
250,846537.0,Overactive bladder: $Optimizing qua@@lity of care,,Am. J. Managed Care,,1088-0224,,2.0,,S46-S61,{Lemack G.E.}
251,973076.0,Thyroid-related autoantibod#ies an#d celiac disease: a role for a gluten-free diet?,,Journal of Clinical Gastroenterology,,,,3.0,1/2/09,,
252,931402.0,Providing access to specialty care for severely disabled institutional residents: an academic health center telemedicine model,,Journal of Health Care for the Poor & Underserved,,1049-2089,20.0,2.0,1/9/01,415-422 8p,{A. K. MarceeS. P. RoatenJ. B. MorrowK. J. KowalskeL. E. SnellL. L. Goetz}
253,908690.0,,English,,,1475-925X,10.0,0.0,1/11/01,22,{Address CorrespondenceS. KarimifardAddresses Authorahmadian@sina.tums.ac.ir Tehran Medical PhysicsTehran Medical PhysicsDepartment of Biomedical Systems S. KarimifardTums Tehran Iran Email University of Medical SciencesA. AhmadianTums Tehran Iran University of Medical SciencesSystems Department of Biomedical}
254,417373.0,Shared decision making and the future of managed care,,Disease Management and Clinical Outcomes,,1088-3371,1.0,1.0,1/1/97,,{J. #E. %Wennberg}
255,759329.0,Specific plasma factors blocking human maternal cell-mediated immune reaction to placental a#ntigens.,eng,Nature: New biology,Nature New Biol.,,242.0,117.0,3/28/73,110-1,
256,,MicroRNAs: a new piece in the paediatric cardiovascular disease puzzle.,en$g$,Cardiology in the young,,1467-1107,23.0,5.0,1/13/10,642-55,{Dalia ElimamKeith A WebsterAhmed OmranFei YinLina A Shehadeh}
257,695010.0,Association of Ureaplasma urealyticum colonization with development of bronchopulmona??ry dysplasia: a systemic@@ review and meta-analysis.,eng,,,1672-0733,34.0,2.0,1/14/#%04,265-9,{Jia-rui PuDan LiDe-hua YangLi-duan ZhengXiao-dan ZhengHong MeiXuan XiangQiang-song Tong}
258,191908.0,Mortality at older ages and moves in residential and sheltered housing: evidence from the UK,,,,0143-005X,68.0,6.0,1/14/01,524-529,
259,384767.0,A multinational study of thromboprophylaxis practice in critically ill children.,eng,,Crit. Care Med.,1530-0293,42.0,5.0,1/14/05,1232-40,{Sarah H O'BrienMarisa TucciAntonio Rodriguez NunezPhilip C SpinellaLi QinEdward Vincent S FaustinoAdrienne G RandolphEdward TruemperSimon LiKimberly MarohnSheila HansonMichael Yung[Collective Name] PROphylaxis against ThRombosis prACTice (PROTRACT) Study Investigators of the PALISI BloodNet}
260,4997466.200735128,Asymmetric inheritance of mitochondrial content in aging budding yeast cells,English,,,,23.0,,,,
261,,Physical activity moderates time-of-day differences in older adults' working memory performance.,,Experimental Aging Research,,0361-073X     1096-4657,32.0,4.0,1/6/10,431-446 16p,{DeLosh ELBugg JMClegg BA}
262,816996.0,Uses of the electrical skin resistance method in the study of patients with neck and upper extremity pain,English,Johns Hopkins Medical Journal,JOHNS HOPKINS %M@@ED. J.,,137.0,2.0,1/1/75,69-74,{C.P. RichterL.H. Riley Jr.}
263,625016.0,[New aspects in hernia surgery].,ger,Urologe A,,,44.0,7.0,1/5/07,774-9,{P E GoretzkiB J LammersT Otto}
264,275675.0,An exploration of self-reported negative affect by ad%olescents as a reason for smoking: implications for tobacco prev%ention and intervention programs,,Prev Med,Preventive medicine,0091-7435,,,1/5/01$,589-96,{J. RobinsonD. W. SmithB. ColwellS. L. StevensC. McMillan}
265,967376.0,Diagnosis of peripheral lung cancer with three echoic features via endobronchial ultrasound,Engl#ish,Chest,,,132.0,3.0,1/7/01,,{H. C. ChenS. M. Li??nC. L. ChouC. T. YuH. P. KuoC. @@H. Kuo}
266,640230.0,A meta-analysis of labor supply effects of interventions for major depressive disorder.,,Psychiatric Services.,,1075-2730,57.0,2.0,,212-8,
267,625663.0,,eng,Archives of General Psychiatry,Arch.Gen.Psychiatry,,61.0,24.075501800545567,1/4/07,,{Paola BolliniGiuseppe TibaldiBruce KupelnickCarmine MunizzaSandro Pampallona}
268,480649.0,Dyspareunia and sexual dysfunction following vaginal delivery in thai primiparous women with second degree perineal tear: A prospective cohort study,,Journal #of Sexual Medic@@ine,,,12.0,0.0,1/15/01,58,{A. UngkanungdechaC. ChayachindaJ. VeeragulJ. Jisabai}
269,782541.0,eComment. EuroSCORE% II - corrected in-hospital mortality rate in a modern cohort of patients undergoing cardiac surgery,English,Interactive Cardiovascular & Thoracic Surgery,Interact Cardiovasc Thorac Surg,1569-9285,19.0,5.0,,733,{D. G. Nezic}
270,692358.0,The effect of a cervical lateral glide on the upper limb neurodynamic test: a blinded placebo-controlled investigation,,The Chartered Society of Physiotherapy Annual Congress and Exhibition: Defining Practice Friday October 17 to Sunday October 19 2003 International Convention Centre Birmingham.,,,0.0,0.0,1/3/01$,10-Oct,{A GreenJ LewisC WorsfoldJ Saranga}
271,,Thoracic Aortic Aneurysm: Reading the Enemy's Playbook,,Curr. Probl. Cardiol.,,-10475,33.0,27.801119920818877,,203-277,{Elefteriades J.A.}
272,867207.0,Early predicting of blood component quality by Statistical Process Control,,Vox Sanguinis,,0042-9007,99.0,0.0,1/10/01,227,
273,253149.0,Lifetime risk of suicide in affective disorders,,,,0#007-1250 1472-1465,173.0,0.0,1/1/98,185-185,{A. S. LeeS. DaviesP. C. Naik}
274,929971.0,A geographic analysis of chronically homeless adults before and after enrollment in a multi-site supported housing initiative: communi#ty characteristics and migrat$ion,,American Journal of Community Psychology,,0091-0562,48.0,3.0,1/11/01,341-51,{R. A. RosenheckJ. TsaiA. S. Mares}
275,,Fetal cleft lip and palate detection by three-dimensional ultrasonography,,Ultrasound Obstet. Gynecol.,,-8906,92.85161980599108,4.0,,,{Lee W.Kirk J.S.Shaheen K.W.Romero R.Hodges A.#N.Comstock C.H.}
276,731703.0,Substance Abuse and Trauma in Incarcerated Wom%en,,,,,0.0,0.0,1/11/01,,{NCT0141@@398%4 }
277,,Use of Job Design to Reduce Mechanical Stress on the Back,,,,,0.0,0.0,1/1/89,,{D. W. Badger}
278,,Rehabilitation of swallowing by exercise in tube-fed patients with pharyngeal dysphagia secondary to abnormal UES opening.,eng,Annual Abstract Supplement,,0016-5085,122.0,5.0,1/2/05,1314-21,{Mark KernKaren DikemanBarbara GrandeMarta KazandjianTerilynn NitschkeStephanie DanielsBenson MasseyReza ShakerCaryn Easterling}
279,653325.0,A meta-analysis of two genome-wide association studies identifies 3 new loci for alcohol dependence.,eng,Journal of psychiatric research,J Psychiatr Res,1879-1379,45.0,,1/11/11,1419-25,{Min ZengYue PanQunyuan ZhangKe-Sheng WangNagesh AragamXuefeng Liu}
280,893573.0,Crowdsourced Multimedia Enhanced Spatio-temporal Constraint Based on-Demand Social Network for Group Mobility,,,,978-1-4503-3459-4,,0.0,1/15/01,761-762,{Ahmad QamarMuhammad ShahidMd. Abdur RahmanAhmed LbathAkhlaq AhmadFaizan Ur RehmanAbdullah MuradBilal Sadiq}
281,,Impaired default network functional connectivity in autosomal dominant Alzheimer disease.,,,Neurology,1526-632X,359.71310982760497,36.61250755531124,8/20/13,736-44,{Virginia D BucklesAndrew J SaykinEric McDadeStephen P SallowayAaron P SchultzPeter R SchofieldRandall BatemanAdam M BrickmanNick C FoxJohn C MorrisJohn M RingmanChristopher C RowePaul ThompsonClifford JackBeau M AncesAllison M GoateRobert A KoeppeStephen CorreiaJasmeer P ChhatwalCaroline A SullivanAnne M FaganRichard MayeuxDaniel S MarcusTammie L S BenzingerKeith JohnsonReisa A SperlingChengjie Xiong}
282,737786.0,Cranial reconstruction of major traumatic defects in children with osteoinductive and resorbable materials,,International Journal of Oral and Maxillofacial Surgery,,0901-5027,40.0,0.0,1/11/01,1024-1025,{R. R. M. BosE. W. HovingM. Wagemakers}
283,,Meta-analysis of the effects of sometribove zinc suspension on the production and health of lactating dairy cows.,eng,Journal of the American Veterinary Medical Association,J. Am. Vet. Med. Assoc.,,245.0,,1/1#4/09#,550-64,{William W ThatcherNormand R St-PierreDale E BaumanJoseph S HoganK Larry SmithRobert J CollierGeorge A MillikenJan K Shearer}
284,201827.72276390187,Journal of Health Communication : International Perspectives The Effect of an Internet-Based  Stage- Matched Message Intervention on Young Taiwanese Women ' s Physical Activity,,,,,0.0,,1/14/01,37-41 DO  - 10.1080/10810730902805788,{Sheu-jen HuangMaiga ChangWen-chi HungJanie Chang}
285,1762818.998237416,,,,,,,4.0,1/7/01,,
286,198650.0,Wo@@un??d care,,,,,7.0,0.0,,27-32 ST  - Wound care-,{NU#LL}
287,671386.0,,$eng$,Journal of medical imaging and radiation oncology,J Med Imaging Radiat Oncol,1754-9485,57.0,5.0,,529-33,{Jasmin AbbasCholpan JasaabuuAndreas Gunter BachAle??xey SurovDominik S@@chrammAndreas Wienke}
288,981412.0,Plant Kunitz proteinase inhibitor attenuates inflammation oxidative stress and remodeling induced by elastase in mice,,European Respiratory Journal,,,44.0,0.0,1/14/01,,{N. M. PinheiroR. Almeida-ReisL. OlivaM. A. MartinsM. L. V. OlivaO. A. Theodoro-JuniorE. A. LeickI. F. L. C. TibrioC. M. PradoR. F. RighettiB. T. M. Oliveira}
289,785472.0,,%eng,,PloS one,1932-6203,7.0,,1/12/01,e35061,{G. RahavG. Regev-YochayI. AbullaishA. ElhamdanyR. MalleyM. RazA. GoralY. RoytmanB. ShainbergM. VaronA. Ziv}
290,734077.0,Direct healthcare costs and cost-effectiveness of acute coronary syndrome secondary prevention with ticagrelor compared to clopidogrel: Economic evaluation from the public payer's perspective in Poland based on the PLATO trial results,English,,,0022-9032,,9.0,1/14/01,,{M. NiewadaJ. PaweskaA. BudajT. MaciochP. Perkowski}
291,46028.0,,eng,European journal of applied physiology and occupational physiology,Eur J Appl Physiol Occup Physiol,0301-5548,,3.6047269782932783,1/1/9@@6,7-Jan,{S IkawaM SudohM SuzukiS MatsubaraM ShiotaK Kawakami}
292,743129.0,Hormonal and dietary characteristics in obese human subjects with and without food addiction.,eng,Nutrients,Nutrients,,7.0,1.0,1/15/01,223-38,{Pardis PedramGuang Sun}
293,392246.0,Importance of membrane materials for blood purification devices in critical care.,eng,Transfusion and apheresis science : official journal of the World Apheresis Association : official journal of the European Society for Haemapheresis,,,40.0,1.0,1/9/02,23-31,
294,904889.0,Myofascial trigger points: Spontaneous electrical activity and its consequences f@@or pain induction and propagation,,Chin. Med,,1749-8546,6.0,0.0,,,{Ge H.-Y.Fernndez-de-las-Peas C.Yue S.-W.}
295,360147.0,Treatment of large vessel vasculitis,,Current Immunology Reviews,,1573-3955     1875-631X,7.0,,,435-442,{M. A. AlbaS. Prieto-GonzalezA. Garcia-MartinezM. C. CidM. ButjosaG. Espigol-FrigoleJ. Hernandez-Rodriguez}
296,670289.0,Quantitative assessment of the influence of common variations (rs8034191 and rs1051730) at 15q25 and lung cancer risk.,,Tumour biology : the journal of the International Society for Oncodevelopmental Biology and Medicine,,1423-0380,35.0,3.0,1/14/03,2777-85,{Bin HuHong-ju MaoJing ZhaoYing HuangRong-huan YuChao Guan}
297,821702.0,Cognitive deficits and psychosis in Parkinson's disease: A review of pathophysiology and therapeutic options,English,CNS Drugs,,,20.0,6.0,1/6/0@@%1,,
298,,Incidence of multi-resistance in gram-negative aerobes from intensive care units of 10 German hospitals.,eng$%,Scandinavian journal of infectious diseases. Supplementum,Scand J Infect Dis Suppl,0300-%8878,78.0,-1.0,1/1/91,22-34,{R AsangerP M ShahF M Kahan}
299,321660.0,Tuberculosis and high altitude. Worth a try in extensively drug-resistant tuberculosis?,English,,,,189.0,4.0,,390-3,{J. F. Murray}
300,427455.0,Cultural humility: essential foundation for clinical researchers.,eng,,Appl Nurs Res,1532-8201,26.0,4.0,1/13/11,2%51-6,{Kath%erine A YeagerSusan Bauer-Wu%}
301,246204.0,Primary external fixation versus plaster immobilization of the intra-articular unstable distal radial fracture in the elderly,,Aktuelle Traumatologie,,,34.0,2.0,1/4/01,64-70,{J. OskamJ. H. HegemanJ. PalenH. J. DuisP. A. M. Vierhout}
302,857402.0,High resolution EPR spectroscopy of C(60)F and C(70)F in solid argon: reassignment of C(70)F regioisomers,,JOURNAL OF CH@@EMICAL PHYSICS??,J Chem Phys,1089-7690,127.0,8.0,,84301,{$D. A. TyurinV. A. BelovD. N. LaikovA. V. AkimovE. Y. Misochko}
303,704357.0,Clinical and radiological results of calcium phosphate cement-assisted balloon osteoplasty for Colles' fractures in osteoporotic senile female patients,eng,,Journal of orthopaedic science : official journal of the Japanese #Orthopaedic Association,0949-2658 (Print) 0949-2658,15.0,2.0,,2??0@@4-9,{A. SudoS. IshiguroK. Iida}
304,716785.0,,,,,,,2.0,1/2/01,119-125 7p,{@@Rutherford OMKennedy JSkelton DA}
305,746065.0,Anxiety and depression in patients with chronic obstructive pulmonary disease: an open agenda for research.,,Rev Med Chir Soc Med Nat Iasi,,0048-7848 (Print) 0048-7848,118.0,1.0,,,{Costin M.Dumbrav__ E.L.Postolache P.Cojocaru D.C.}
306,738322.0,Classification of autogenous skull grafts in cranial reconstruction,eng,,The Journal of the Oklahoma State Medical Assoc%iation,0030-1876 (Print) 0030-1876,86.0,7.0,,327-32,{S. PelofskyP. D. Hunter}
307,934177.0,An Assessment of Voluntary Adolescent Mental Health Screening and Referral in a Children's Hospital Emergency Department,,,,,0.0,,,,{NCT00750412 }
308,1751014.420863463,Implementing participatory intervention and research in communities: lessons from the Kahnawake Schools Diabetes Prevention Project in Canada,English@@,Social Science and Medicine,,,,,1/3/01,1295-1305,{T DelormierA C MacaulayM CargoA M McComberL Potvin}
309,,Bile acid metabolism by fresh human colonic contents: a comparison of caecal versus faecal samples.,,Gut,Gut,,,6.0,1/1/12,835-42,{R H DowlingG M MurphyP B HylemonG FrenchM J VeyseyL A Thomas}
310,499983.0,The role of viral infection in pulmonary exacerbations of     bronchiectasis in adults: a prospective study,English,Chest,,,147.0,6.0,1/15/01,1635-1643,{Gao YHLin ZYZhang GJZhong NSChe#n RCGao YTang YLin ZMXu GLi HMGuan WJ}
311,452432.0,Feverfew (Tanacetum parthenium L.): A systematic review.,,,,,0.0,0.0,,,{#NULL??}
312,1319010.4793895665,Impact of second-line drug resistance on tuberculosis treatment outcomes in the United States: MDR-TB is bad enough,English,,,,16.0,10.0,,1331-4,{J. P. CegielskiS. P. Althomsons}
313,735083.0,,ENG,European journal of applied physiology,,1439-6327,-1.0,,8/15/10,,{Sebastien RacinaisOlivier GirardLars NyboMagni MohrMartin Thomassen}
314,978471.0,Chapter 25 - Skin Manifestations of HIV Infection,,,,,0.0,0.0,,663-695,
315,152626.0,Recurrent distal 16q duplication and terminal 22q deletion: prenatal diagnosis and genetic counseling,eng,,,,49.0,0.0,1/10/01,544-7 ST  - Recurrent distal 16q duplication and terminal 22q deletion: prenatal diagnosis and genetic counseling-,{D. D. TownC. P. ChenY. N. SuW. CN  - PubMed DA  - Dec DO  - 10.1016/s1028-4559(10)60117-9 DP  - NLM ET  - 2011/01/05 WangC. W. PanC. C. LeeF. J. TsaiP. C. WuM. C. Huang}
316,472370.52429441095,Role of core-needle biopsy in thyroid nodules with initially nondiagnostic cytologic results.,eng,Radiology,,1527-1315,270.0,2.0,1/14/02@@,629-30,{Qiao-Hong HuZhi-Liang HuangXiao-Ming FanShuang-Xi ChenXiang-Yang SongXiao-Ying Qiu}
317,776651.0,The endoplasmic reticulum-associated VP7 of rotavirus is targeted to axons and dendrites in polarized neurons,English,Journal of Neurocytology,,,22.0,8.0,,$616-626,{K. KristenssonL. SvenssonH. B. GreenbergK. Weclewicz}
318,931361.0,Telemedicine in the management of chronic pain: a cost analysis study,,Canadian Journal of Anaesthesia,,,56.0,37.41689262682179,1/9/01,590-6,{R. KernA. PronovostP. Peng}
319,623358.0,Moderation of cognition-intention and cognition-behaviour relations: a meta-analysis of properties of variables from the theory of planned behaviour.,eng,The British journal of social psychology / the British Psychological Society,Br J Soc Psychol,0144-6@@665,43.0,,1/4/06,,
320,,Normalisati%on of left ventricular systolic function after change from VVI pacing to b??iventricular pacing in a child with congenital complete atrioventricular block long-QT syndrome and congenital muscular dystrophy: a 10-year follow-up.,eng,??Cardiol#ogy in the young,Cardiol Young,1467-1107,24.0,3.0,1/14/06,520-3,{Jesper I ReimersSabrina G ElleseHenrik  Andersen}
321,,Estimating the Effect of Land Leases on Prices of Inner-city Apartment Buildings,,U%rban Studies (Routledge),,,40.0,10.0,1/3/01,2049,
322,515254.0,Radiographic detection of artificially created horizontal root fracture using different cone beam CT units with small fields of view.,eng,Dento maxillo facial radiology,,0250-832X,42.0,4.0,1/13/01,117724157.60007669,{S MuratH AvseverS Y_kselC S PaksoyB OnderK Kamburoglu}
323,674623.0,Pharmacological treatments for obsessive-compulsive disorder in children and adolescents: a qualitative review.,eng,Actas espaolas de psiquiatr_a,Actas Esp Psiquiatr,1578-2735,41.0,3.0,1/13/05,196-203,{Angel Rosa-AlczarAna I Rosa-AlczarMarina Iniesta-Sep_lveda}
324,226419.0,Anterior approach unilateral right sacrospinous fixation for recurrent pelvic organ prolapse following multiple colorectal surgeries.,ENG,International journal of colorectal disease,Int J Colorectal Dis,,-1.0,-1.0,7/15/01,,{Enie Akhtar Bt NawawiAhlam M Al-KharabshehTsia-Shu Lo}
325,944617.3213479347,,,,,,13.0,0.0,1/6/01,173-181,{J. De La CameraM. M. MesfinA. M. KedirG. AmanualT. ArayaI. G. Tareke}
326,453637.0,Corneal collagen cross-linking for nonectatic disorders: A systematic review.,,,,,0.0,0.0,,,{NULL}
327,57483.0,Multiple dural arteriovenous fistulas presenting as@@ rapidly progressive dem$entia.,eng,The neurologist,,,18.0,3.0,,130-2,{Diana DuroAugusto GouloGon_alo SantosNuno Mendon_aIsabel SantanaEg_dio Machado}
328,462849.0,Methodological Review of the Quality of Reach Out and Read: Does It &quot;Work&quot;?,,,,,,0.0,,,{NULL}
329,,New therapies in soft tissue sarcoma,,Expert opinion on emerging drugs,Expert Opin Emerg Drugs,,,2.0,1/1$#0/01,237-48,{Bruno VincenziDaniele SantiniGiuseppe ToniniAnna Maria Frezza}
330,438808.0,Descemet's stripping endothelial keratoplasty: safety and outcomes: a report by the American Academy of Ophthalmology,,,,,0.0,0.0,,,
331,352040.0,Usefulness of a Survey on Underage Drinking in a Rural American Indian Community Health Clinic,,American Indian and Alaska Native Mental Health Research: The Journal of the National Center,,1533-7731,,2.0,1/13/01,26-Jan,{Joel W. GrubeJuan A. LunaDavid A. GilderJennifer RobertsDaniel CalacCindy L. EhlersRoland S. Moore}
332,887131.0,Antidiabetic oral treatment in older people: does frailty matter?,eng,Drugs & aging,Drugs@@ Aging,1179-1969,26.0,-1.0,,53-62,{Angela Marie AbbatecolaAndrea CorsonelloSilvia BustacchiniFabrizia LattanzioGiuseppe Paolisso}
333,182296.0,,,,,,,0.0,1/6/01,331-373,{Aitken Alderson Anderson Aptekar Backett-Milburn Beazley Becker Bello Berman Billig Bluebond-Langner Borchgrevink Bucholtz Christensen Constantino Cornwall Dell Clark DiCarlo Diprose Douglas Downe Geissler Goodenough Hart James James Jocano Ka@@tz Koppitz L AguilarLisa M. Mitchell}
334,159819.44530554136,[Dinggui Oil Capsule in treating irritable bowel syndrome with stagnation of qi and cold: a prospective multi-center randomized placebo-controlled double-blind trial],chi%$,,,,,0.0,1/7/01,392-7 ST  - [Dinggui Oil Capsule in treating irritable bowel syndrome with stagnation of qi and cold: a prospective multi-center randomized placebo-controlled double-blind trial]-,
335,524073.0,Evaluation of technical quality of endodontic treatment--reliability of intraoral radiographs.,eng,Endodontics & dental traumatology,Endod Dent Traumatol,,13.0,6.0,,259-64,{M EckerbomT Magnusson}
336,348813.0,Experience in one centre using the buttoned device for occlusion of atrial septal defect: comparison with the Amplatzer septal occluder.,eng,Cardiol Young,Cardiology $in the young,,10.0,16.08028136865875,,527-33,{G VaksmannA VincentelliC FrancartM A CajotG M BrevireF GodartJ M CoulletP DevosC Rey}
337,427933.0,Consciousness coma and caring for the brain-injured patient.,e??n%g,AACN Clinical Issues: Advanced Practice in Acute & Critical Care,,,49.42040743020638,4.0,1/5/10,441-55,{Carmelo GraffagninoDaiWai M Olson}
338,,Long-term outcome for immune suppression and immune related lymphoproliferative disorder: Prospective data from the United Kingdom Children's Leukaemia and Cancer Group registry 1994-2004,,Leukemia and Lymphoma,,NCT00227591/ClinicalTrials.gov NCT00509899/ClinicalTrials.gov NCT00599547/ClinicalTrials.gov NCT00631462/ClinicalTrials.gov NCT00934544/ClinicalTrials.gov NCT00952289/ClinicalTrials.gov NCT01420770/ClinicalTrials.gov NCT01437787/ClinicalTrials.gov,53.0,5.0,1/12/01,,{A. WotherspoonM.M. TajN. HadzicM. BurkeR. HobsonS.E. HeightM. ViskadurakiC.R. Pinkerton}
339,,,eng,The hematology journal : the official journal of the European Haematology Association / EHA,Hematol. J.,1466-4860,5.0,6.722080855709122,1/4/01#,112-7,
340,2966818.8358275937,A controlled trial of anterior spinal fusion and dbridement in the surgical management of tuberculosis of the spine in patients on standard chemotherapy: a study in two centres in South Africa. Seventh Report of the Medical Research Council Working Party on tuberculosis of the spine,,,,,59.0,,1/1/78,,{NULL}
341,734870.0,Stress across the life course and depression in a rapidly developing population: the Guangzhou Biobank Cohort Study.,EN??G,International journal of geriatric psychiatry,Int J Geriatr Psychiatry,1099-1166,1.0,-1.0,9/15/10,,{Stephen E GilmanChaoqiang JiangKar Keung ChengC Mary SchoolingTai Hing LamMichael Y NiGabriel M LeungWeisen Zhang}
